resolution,date,chart,fiscal_year,action,source,council_member,organization,program,ein,amount,agency,agy_num,ua,purpose,flags
1,2021-07-29,Neighborhood Development Grant Initiative - Fiscal 2022,2022,designate,,,"Gibson CITYarts, Inc.",Council District 16,132766701,10000,SBS,801,002,,
1,2021-07-29,Neighborhood Development Grant Initiative - Fiscal 2022,2022,designate,,,"Rivera Cooper Square Community Development Committee, Inc.",Merchant Organizing,132666211,10000,SBS,801,002,,
1,2021-07-29,Neighborhood Development Grant Initiative - Fiscal 2022,2022,designate,,,"Cabrera Davidson Community Center, Inc.",Economic Development Program,237010206,20000,SBS,801,002,,
1,2021-07-29,Neighborhood Development Grant Initiative - Fiscal 2022,2022,designate,,,"Downtown Flushing Transit Hub District Management Association, Inc.",District Marketing / Koo Local Tourism,412111487,40000,SBS,801,002,,
1,2021-07-29,Neighborhood Development Grant Initiative - Fiscal 2022,2022,designate,,,"Fordham Road District Management Association, Inc.",Fordham Road BID - Digital Marketing / Cabrera Membership Support & Advocacy,260117797,10000,SBS,801,002,,
1,2021-07-29,Neighborhood Development Grant Initiative - Fiscal 2022,2022,designate,,,"Rodriguez Grand Slam foundation, Inc.",Organizational Development/Project Management Support,271822546,20000,SBS,801,002,,
1,2021-07-29,Neighborhood Development Grant Initiative - Fiscal 2022,2022,designate,,,Holden Greater Ridgewood Restoration Corporation,Council District 30,112382250,25000,SBS,801,002,,
1,2021-07-29,Neighborhood Development Grant Initiative - Fiscal 2022,2022,designate,,,Johnson Greenwich Village Chelsea Chamber of Commerce,,201419879,10000,SBS,801,002,,
1,2021-07-29,Neighborhood Development Grant Initiative - Fiscal 2022,2022,designate,,,"Perkins Harlem Business Alliance, Inc.",Council District 9,133591350,10000,SBS,801,002,,
1,2021-07-29,Neighborhood Development Grant Initiative - Fiscal 2022,2022,designate,,,"Perkins Harlem Week, Inc.",Business Outreach & Support,133058019,10000,SBS,801,002,,
1,2021-07-29,Neighborhood Development Grant Initiative - Fiscal 2022,2022,designate,,,"Hispanic Federation, Inc.",Placemaking/Plaza/Public Space Activation/Public Art at Quisqueya Rodriguez Plaza,133573852,20000,SBS,801,002,,
1,2021-07-29,Neighborhood Development Grant Initiative - Fiscal 2022,2022,designate,,,"Dromm Horticultural Society of New York, The",Neighborhood Development Grant Initiative,130854930,20000,SBS,801,002,,
1,2021-07-29,Neighborhood Development Grant Initiative - Fiscal 2022,2022,designate,,,"Johnson Hudson Yards Hell's Kitchen Business Improvement District, Inc.",,471247857,20000,SBS,801,002,,
1,2021-07-29,Neighborhood Development Grant Initiative - Fiscal 2022,2022,designate,,,Mosholu Preservation Corporation,"Business Support, Promotion, and Retention - Council Riley District 12",133109387,40000,SBS,801,002,,
1,2021-07-29,Neighborhood Development Grant Initiative - Fiscal 2022,2022,designate,,,"Powers Murray Hill Committee, Inc.",,237361016,20000,SBS,801,002,,
1,2021-07-29,Neighborhood Development Grant Initiative - Fiscal 2022,2022,designate,,,"Neighborhood Housing Services of Brooklyn (Bedford-Stuyvesant) CDC, Inc.",Neighborhood Cornegy Development Grant Initiative,471717438,20000,SBS,801,002,,
1,2021-07-29,Neighborhood Development Grant Initiative - Fiscal 2022,2022,designate,,,"Perkins New York Women's Chamber of Commerce, Inc.",Council District 9,141845651,10000,SBS,801,002,,
1,2021-07-29,Neighborhood Development Grant Initiative - Fiscal 2022,2022,designate,,,"Van Bramer PS1 Contemporary Art Center, Inc.",Public Space Activation,237379091,20000,SBS,801,002,,
1,2021-07-29,Neighborhood Development Grant Initiative - Fiscal 2022,2022,designate,,,Adams Queens Economic Development Corporation,Council District 28,112436149,10000,SBS,801,002,,
1,2021-07-29,Neighborhood Development Grant Initiative - Fiscal 2022,2022,designate,,,Queens Economic Development Corporation,Small Business Services and Workforce Dromm Development,112436149,20000,SBS,801,002,,
1,2021-07-29,Neighborhood Development Grant Initiative - Fiscal 2022,2022,designate,,,"Gennaro RPGA Studio, Inc.",,472589237,10000,SBS,801,002,,
1,2021-07-29,Neighborhood Development Grant Initiative - Fiscal 2022,2022,designate,,,Ayala South Bronx Overall Economic Development Corporation,Buy Local South Bronx,132736022,40000,SBS,801,002,,
1,2021-07-29,Neighborhood Development Grant Initiative - Fiscal 2022,2022,designate,,,"Rose Staten Island Chamber of Commerce Foundation, Inc.",Downtown Staten Island N360,134069282,10000,SBS,801,002,,
1,2021-07-29,Neighborhood Development Grant Initiative - Fiscal 2022,2022,designate,,,Staten Island Economic Development Corporation,New Dorp Lane Business Improvement Matteo District,133706442,20000,SBS,801,002,,
1,2021-07-29,Neighborhood Development Grant Initiative - Fiscal 2022,2022,designate,,,Matteo Staten Island Economic Development Corporation,Victory Boulevard Merchants,133706442,20000,SBS,801,002,,
1,2021-07-29,Neighborhood Development Grant Initiative - Fiscal 2022,2022,designate,,,Van Bramer Sunnyside District Management Association,,261278224,20000,SBS,801,002,,
1,2021-07-29,Neighborhood Development Grant Initiative - Fiscal 2022,2022,designate,,,"Gennaro Volunteers of Legal Service, Inc.",,133234630,10000,SBS,801,002,,
1,2021-07-29,Neighborhood Development Grant Initiative - Fiscal 2022,2022,designate,,,West Brighton Community Local Development Corporation,Castleton Avenue Merchant Rose Organization Initiative,133046424,10000,SBS,801,002,,
1,2021-07-29,Neighborhood Development Grant Initiative - Fiscal 2022,2022,designate,,,Gibson Women's Housing and Economic Development Corporation (WHEDco),Council District 16,113099604,20000,SBS,801,002,,
1,2021-07-29,Neighborhood Development Grant Initiative - Fiscal 2022,2022,designate,,,Gibson Yemeni American Merchants Association,Council District 16,823539502,10000,SBS,801,002,,
1,2021-07-29,Neighborhood Development Grant Initiative - Fiscal 2022,2022,designate,,,Adams Yemeni American Merchants Association,Council District 28,823539502,10000,SBS,801,002,,
1,2021-07-29,Neighborhood Development Grant Initiative - Fiscal 2022,2022,designate,,,Cabrera Yemeni American Merchants Association,Merchant Services Program,823539502,10000,SBS,801,002,,
1,2021-07-29,Neighborhood Development Grant Initiative - Fiscal 2022,2022,rescind,,,Department of Small Business Services,,136400434,-125000,SBS,801,002,,**
1,2021-07-29,Neighborhood Development Grant Initiative - Fiscal 2022,2022,designate,,,"Rose Amethyst House, Inc.",,222321612,10000,DYCD,260,005,,**
1,2021-07-29,Neighborhood Development Grant Initiative - Fiscal 2022,2022,designate,,,"Rose Central Family Life Center, Inc., The",Rebuilding Better Initiative,133626127,10000,DYCD,260,005,,**
1,2021-07-29,Neighborhood Development Grant Initiative - Fiscal 2022,2022,designate,,,"Menchaca Council on the Environment, Inc.",Winter GreenMarkets,132765465,40000,DYCD,260,005,,**
1,2021-07-29,Neighborhood Development Grant Initiative - Fiscal 2022,2022,designate,,,"Moya Hispanic Federation, Inc.",,133573852,40000,DYCD,260,005,,**
1,2021-07-29,Neighborhood Development Grant Initiative - Fiscal 2022,2022,designate,,,Holden Myrtle Avenue District Management Association,,112912570,15000,DYCD,260,005,,**
1,2021-07-29,Neighborhood Development Grant Initiative - Fiscal 2022,2022,designate,,,Rivera Yemeni American Merchants Association,Merchant Organizing,823539502,10000,DYCD,260,005,,**
1,2021-07-29,NYC Cleanup Initiative - Fiscal 2022,2022,rescind,,,Department of Youth and Community Development,,136400434,-4016706,DYCD,260,005,,
1,2021-07-29,NYC Cleanup Initiative - Fiscal 2022,2022,designate,,,"Adams Association of Community Employment Programs for the Homeless, Inc.",Council District 28,133846431,146706,DYCD,260,005,,
1,2021-07-29,NYC Cleanup Initiative - Fiscal 2022,2022,designate,,,Adams New York City H2O,Baisley Pond Volunteer Clean-Up,453860014,10000,DYCD,260,005,,
1,2021-07-29,NYC Cleanup Initiative - Fiscal 2022,2022,designate,,,"Ayala Association of Community Employment Programs for the Homeless, Inc.",Council District 8,133846431,250000,DYCD,260,005,,
1,2021-07-29,NYC Cleanup Initiative - Fiscal 2022,2022,designate,,,"Ayala Capitol District Management Association, Inc.",Clean up Services - Council District 8,270699754,30000,DYCD,260,005,,
1,2021-07-29,NYC Cleanup Initiative - Fiscal 2022,2022,designate,,,Cabrera Center for Employment Opportunities,Council District 14 - Clean-up Program,133843322,60000,DYCD,260,005,,
1,2021-07-29,NYC Cleanup Initiative - Fiscal 2022,2022,designate,,,Cabrera Wildcat Service Corporation,Council District 14 - Neighborhood Improvement Program,132725423,100000,DYCD,260,005,,
1,2021-07-29,NYC Cleanup Initiative - Fiscal 2022,2022,designate,,,"Cornegy Association of Community Employment Programs for the Homeless, Inc.",,133846431,40000,DYCD,260,005,,
1,2021-07-29,NYC Cleanup Initiative - Fiscal 2022,2022,designate,,,"Bedford Stuyvesant Gateway District Management Association, Inc.",Fulton Street Business Cornegy Improvement District,270295829,30000,DYCD,260,005,,
1,2021-07-29,NYC Cleanup Initiative - Fiscal 2022,2022,designate,,,"Association of Community Employment Programs for the Homeless, Inc.",Cleaning Services - Cumbo Council District 35,133846431,95000,DYCD,260,005,,
1,2021-07-29,NYC Cleanup Initiative - Fiscal 2022,2022,designate,,,Cumbo Center for Employment Opportunities,Council District 35,133843322,20000,DYCD,260,005,,
1,2021-07-29,NYC Cleanup Initiative - Fiscal 2022,2022,designate,,,"Cumbo Central Fulton Street District Management Association, Inc.",A Clean FAB FULTON,800356502,30000,DYCD,260,005,,
1,2021-07-29,NYC Cleanup Initiative - Fiscal 2022,2022,designate,,,"Cumbo Horticultural Society of New York, The","Urban Greening, Beautification, and Maintenance",130854930,20000,DYCD,260,005,,
1,2021-07-29,NYC Cleanup Initiative - Fiscal 2022,2022,designate,,,"Cumbo Myrtle Avenue Brooklyn DMA, Inc.",Council District 35,202659913,45000,DYCD,260,005,,
1,2021-07-29,NYC Cleanup Initiative - Fiscal 2022,2022,designate,,,"Cumbo North Flatbush Avenue District Management Association, Inc.",North Flatbush Clean & Green,112764038,30000,DYCD,260,005,,
1,2021-07-29,NYC Cleanup Initiative - Fiscal 2022,2022,designate,,,"Dromm Association of Community Employment Programs for the Homeless, Inc.",NYC Clean Up,133846431,280000,DYCD,260,005,,
1,2021-07-29,NYC Cleanup Initiative - Fiscal 2022,2022,designate,,,Gennaro Wildcat Service Corporation,Council District 24,132725423,185000,DYCD,260,005,,
1,2021-07-29,NYC Cleanup Initiative - Fiscal 2022,2022,designate,,,"Gibson Association of Community Employment Programs for the Homeless, Inc.",Council District 16,133846431,25000,DYCD,260,005,,
1,2021-07-29,NYC Cleanup Initiative - Fiscal 2022,2022,designate,,,"Gibson Capitol District Management Association, Inc.",161st Street BID - Council District 16,270699754,50000,DYCD,260,005,,
1,2021-07-29,NYC Cleanup Initiative - Fiscal 2022,2022,designate,,,Gibson Center for Employment Opportunities,Council District 16,133843322,25000,DYCD,260,005,,
1,2021-07-29,NYC Cleanup Initiative - Fiscal 2022,2022,designate,,,"Gibson Fund for the City of New York, Inc.",Council District 16 - Bronx Community Solutions,132612524,20000,DYCD,260,005,,
1,2021-07-29,NYC Cleanup Initiative - Fiscal 2022,2022,designate,,,Gibson Wildcat Service Corporation,Council District 16,132725423,70000,DYCD,260,005,,
1,2021-07-29,NYC Cleanup Initiative - Fiscal 2022,2022,designate,,,"Gjonaj Morris Park Community Association, Inc.",,237429900,50000,DYCD,260,005,,
1,2021-07-29,NYC Cleanup Initiative - Fiscal 2022,2022,designate,,,"Grodenchik Association of Community Employment Programs for the Homeless, Inc.",Council District 23,133846431,80000,DYCD,260,005,,
1,2021-07-29,NYC Cleanup Initiative - Fiscal 2022,2022,designate,,,"Grodenchik Outstanding Renewal Enterprises, Inc.",Council District 23 - E Waste Events,133320984,10000,DYCD,260,005,,
1,2021-07-29,NYC Cleanup Initiative - Fiscal 2022,2022,designate,,,Grodenchik Queens Economic Development Corporation,Council District 23,112436149,30000,DYCD,260,005,,
1,2021-07-29,NYC Cleanup Initiative - Fiscal 2022,2022,designate,,,Grodenchik Wildcat Service Corporation,Council District 23,132725423,60000,DYCD,260,005,,
1,2021-07-29,NYC Cleanup Initiative - Fiscal 2022,2022,designate,,,"Holden Association of Community Employment Programs for the Homeless, Inc.",Council District 30,133846431,108000,DYCD,260,005,,
1,2021-07-29,NYC Cleanup Initiative - Fiscal 2022,2022,designate,,,Holden Wildcat Service Corporation,Council District 30,132725423,80000,DYCD,260,005,,
1,2021-07-29,NYC Cleanup Initiative - Fiscal 2022,2022,designate,,,Kallos Goddard Riverside Community Center,,131893908,20000,DYCD,260,005,,
1,2021-07-29,NYC Cleanup Initiative - Fiscal 2022,2022,designate,,,Kallos Wildcat Service Corporation,,132725423,140000,DYCD,260,005,,
1,2021-07-29,NYC Cleanup Initiative - Fiscal 2022,2022,designate,,,"Matteo Bloomfield Conservancy, Inc.",,134014664,20000,DYCD,260,005,,
1,2021-07-29,NYC Cleanup Initiative - Fiscal 2022,2022,designate,,,"Matteo Friends of Abandoned Cemeteries, Inc.",,133176456,25000,DYCD,260,005,,
1,2021-07-29,NYC Cleanup Initiative - Fiscal 2022,2022,designate,,,"Matteo Where to Turn, Inc.",,200404386,170000,DYCD,260,005,,
1,2021-07-29,NYC Cleanup Initiative - Fiscal 2022,2022,designate,,,"Menchaca Association of Community Employment Programs for the Homeless, Inc.",,133846431,250000,DYCD,260,005,,
1,2021-07-29,NYC Cleanup Initiative - Fiscal 2022,2022,designate,,,"Moya Association of Community Employment Programs for the Homeless, Inc.",Council District 21,133846431,100000,DYCD,260,005,,
1,2021-07-29,NYC Cleanup Initiative - Fiscal 2022,2022,designate,,,"Perkins Association of Community Employment Programs for the Homeless, Inc.",Council District 9,133846431,20000,DYCD,260,005,,
1,2021-07-29,NYC Cleanup Initiative - Fiscal 2022,2022,designate,,,Perkins Center for Employment Opportunities,CEO Crew Works- Council District 9,133843322,20000,DYCD,260,005,,
1,2021-07-29,NYC Cleanup Initiative - Fiscal 2022,2022,designate,,,Perkins Uptown Grand Central,Positive Workforce Clean Team,811133229,10000,DYCD,260,005,,
1,2021-07-29,NYC Cleanup Initiative - Fiscal 2022,2022,designate,,,Perkins Wildcat Service Corporation,Neighborhood Improvement Program - Council District 9,132725423,30000,DYCD,260,005,,
1,2021-07-29,NYC Cleanup Initiative - Fiscal 2022,2022,designate,,,"Powers Association of Community Employment Programs for the Homeless, Inc.",Council District 4,133846431,160000,DYCD,260,005,,
1,2021-07-29,NYC Cleanup Initiative - Fiscal 2022,2022,designate,,,Riley Wildcat Service Corporation,Neighborhood Improvement Program - Council District 12,132725423,100000,DYCD,260,005,,
1,2021-07-29,NYC Cleanup Initiative - Fiscal 2022,2022,designate,,,"Association of Community Employment Programs for the Homeless, Inc.",Kips Bay/Murray Hill Rivera + Gramercy Cleanup Services,133846431,100000,DYCD,260,005,,
1,2021-07-29,NYC Cleanup Initiative - Fiscal 2022,2022,designate,,,Rivera Department of Sanitation,Manual Litter Patrol Truck @ Council District 2.,136400434,48000,DYCD,260,005,,
1,2021-07-29,NYC Cleanup Initiative - Fiscal 2022,2022,designate,,,"Rivera Outstanding Renewal Enterprises, Inc.",LES Ecology Center,133320984,32000,DYCD,260,005,,
1,2021-07-29,NYC Cleanup Initiative - Fiscal 2022,2022,designate,,,Rivera Wildcat Service Corporation,East Village Cleanup,132725423,100000,DYCD,260,005,,
1,2021-07-29,NYC Cleanup Initiative - Fiscal 2022,2022,designate,,,Rodriguez Bameso USA,,342056362,55000,DYCD,260,005,,
1,2021-07-29,NYC Cleanup Initiative - Fiscal 2022,2022,designate,,,"Rodriguez Community League of the Heights, Inc.",,132564241,55000,DYCD,260,005,,
1,2021-07-29,NYC Cleanup Initiative - Fiscal 2022,2022,designate,,,"Rodriguez La Asociacion Americana De Estudios Culturales Universales, Inc.",,133059518,55000,DYCD,260,005,,
1,2021-07-29,NYC Cleanup Initiative - Fiscal 2022,2022,designate,,,"Rodriguez Renaissance Technical Institute, Inc.",,472048750,55000,DYCD,260,005,,
1,2021-07-29,NYC Cleanup Initiative - Fiscal 2022,2022,designate,,,"Rose Association of Community Employment Programs for the Homeless, Inc.",Cleanup Services,133846431,20000,DYCD,260,005,,
1,2021-07-29,NYC Cleanup Initiative - Fiscal 2022,2022,designate,,,"Rose Friends of Abandoned Cemeteries, Inc.",Historic Cemetery Maintenance,133176456,10000,DYCD,260,005,,
1,2021-07-29,NYC Cleanup Initiative - Fiscal 2022,2022,designate,,,Rosenthal Goddard Riverside Community Center,Council District 6,131893908,232000,DYCD,260,005,,
1,2021-07-29,NYC Cleanup Initiative - Fiscal 2022,2022,designate,,,"Johnson Association of Community Employment Programs for the Homeless, Inc.",Council District 3,133846431,10000,DYCD,260,005,,
1,2021-07-29,NYC Cleanup Initiative - Fiscal 2022,2022,designate,,,"Johnson Association of Community Employment Programs for the Homeless, Inc.",,133846431,200000,DYCD,260,005,,
1,2021-07-29,NYC Cleanup Initiative - Fiscal 2022,2022,rescind,,,Department of Youth and Community Development,,136400434,-2011294,DYCD,260,005,,**
1,2021-07-29,NYC Cleanup Initiative - Fiscal 2022,2022,designate,,,Rodriguez Manhattan Community Board #12,,136400434,10000,MNCB,352,002,,**
1,2021-07-29,NYC Cleanup Initiative - Fiscal 2022,2022,designate,,,"Rose Staten Island Chamber of Commerce Foundation, Inc.",Downtown Staten Island N360,134069282,10000,SBS,801,002,,**
1,2021-07-29,NYC Cleanup Initiative - Fiscal 2022,2022,designate,,,Rodriguez Bronx Community Board #8,,136400434,10000,BXCB,388,002,,**
1,2021-07-29,NYC Cleanup Initiative - Fiscal 2022,2022,designate,,,"Gibson Bronx is Blooming, The","Claremont, Franz Siegel, Mullaly & Joyce Kilmer Parks",463141885,12500,DPR,846,006,,**
1,2021-07-29,NYC Cleanup Initiative - Fiscal 2022,2022,designate,,,Gibson City Parks Foundation,It's My Park - Community Programming,133561657,12500,DPR,846,006,,**
1,2021-07-29,NYC Cleanup Initiative - Fiscal 2022,2022,designate,,,Perkins Department of Parks and Recreation,Col. Young Park,136400434,15000,DPR,846,006,,**
1,2021-07-29,NYC Cleanup Initiative - Fiscal 2022,2022,designate,,,Perkins Department of Parks and Recreation,Fred Samuels Park,136400434,15000,DPR,846,006,,**
1,2021-07-29,NYC Cleanup Initiative - Fiscal 2022,2022,designate,,,Adams Department of Sanitation,NYC Clean Initiative - Council District 28,136400434,123294,DSNY,827,102,,**
1,2021-07-29,NYC Cleanup Initiative - Fiscal 2022,2022,designate,,,Brannan Department of Sanitation,Council District 43,136400434,235000,DSNY,827,102,,**
1,2021-07-29,NYC Cleanup Initiative - Fiscal 2022,2022,designate,,,Cabrera Department of Sanitation,Council District 14 - Litter Basket Service,136400434,120000,DSNY,827,102,,**
1,2021-07-29,NYC Cleanup Initiative - Fiscal 2022,2022,designate,,,Cornegy Department of Sanitation,Council District 36,136400434,210000,DSNY,827,102,,**
1,2021-07-29,NYC Cleanup Initiative - Fiscal 2022,2022,designate,,,Gennaro Department of Sanitation,Extra Pickups - Council District 24,136400434,95000,DSNY,827,102,,**
1,2021-07-29,NYC Cleanup Initiative - Fiscal 2022,2022,designate,,,Gibson Department of Sanitation,Council District 16,136400434,45000,DSNY,827,102,,**
1,2021-07-29,NYC Cleanup Initiative - Fiscal 2022,2022,designate,,,Grodenchik Department of Sanitation,Council District 23,136400434,100000,DSNY,827,102,,**
1,2021-07-29,NYC Cleanup Initiative - Fiscal 2022,2022,designate,,,Matteo Department of Sanitation,Council District 50,136400434,65000,DSNY,827,102,,**
1,2021-07-29,NYC Cleanup Initiative - Fiscal 2022,2022,designate,,,Menchaca Department of Sanitation,Council District 38,136400434,30000,DSNY,827,102,,**
1,2021-07-29,NYC Cleanup Initiative - Fiscal 2022,2022,designate,,,Moya Department of Sanitation,Council District 21,136400434,180000,DSNY,827,102,,**
1,2021-07-29,NYC Cleanup Initiative - Fiscal 2022,2022,designate,,,Perkins Department of Sanitation,Council DIstrict 09,136400434,85000,DSNY,827,102,,**
1,2021-07-29,NYC Cleanup Initiative - Fiscal 2022,2022,designate,,,Riley Department of Sanitation,Council District 12,136400434,180000,DSNY,827,102,,**
1,2021-07-29,NYC Cleanup Initiative - Fiscal 2022,2022,designate,,,Rodriguez Department of Sanitation,Council District 10,136400434,40000,DSNY,827,102,,**
1,2021-07-29,NYC Cleanup Initiative - Fiscal 2022,2022,designate,,,Rose Department of Sanitation,Council District 49,136400434,240000,DSNY,827,102,,**
1,2021-07-29,NYC Cleanup Initiative - Fiscal 2022,2022,designate,,,Rosenthal Department of Sanitation,Council District 06,136400434,48000,DSNY,827,102,,**
1,2021-07-29,NYC Cleanup Initiative - Fiscal 2022,2022,designate,,,Cumbo Department of Sanitation,Council District 35,136400434,40000,DSNY,827,109,,**
1,2021-07-29,NYC Cleanup Initiative - Fiscal 2022,2022,designate,,,Gibson Department of Sanitation,Council District 16,136400434,20000,DSNY,827,109,,**
1,2021-07-29,NYC Cleanup Initiative - Fiscal 2022,2022,designate,,,Johnson Department of Sanitation,Council District 03,136400434,70000,DSNY,827,109,,**
1,2021-07-29,Parks Equity Initiative - Fiscal 2022,2022,rescind,,,Department of Parks and Recreation,,136400434,-1411000,DPR,846,006,,
1,2021-07-29,Parks Equity Initiative - Fiscal 2022,2022,designate,,,"Gibson Bronx is Blooming, The",Council District 16,463141885,10000,DPR,846,006,,
1,2021-07-29,Parks Equity Initiative - Fiscal 2022,2022,designate,,,"Riley Bronx River Alliance, Inc.",Community Engagment - Council District 12,753001587,30000,DPR,846,006,,
1,2021-07-29,Parks Equity Initiative - Fiscal 2022,2022,designate,,,Cornegy City Parks Foundation,,133561657,20000,DPR,846,006,,
1,2021-07-29,Parks Equity Initiative - Fiscal 2022,2022,designate,,,Powers City Parks Foundation,,133561657,35000,DPR,846,006,,
1,2021-07-29,Parks Equity Initiative - Fiscal 2022,2022,designate,,,City Parks Foundation,"CityParks Play (Kissena Park), Partnership for Parks (Weeping Beech Koo Park)",133561657,15000,DPR,846,006,,
1,2021-07-29,Parks Equity Initiative - Fiscal 2022,2022,designate,,,Ayala City Parks Foundation,CityParks Play @ Macombs Dam,133561657,5000,DPR,846,006,,
1,2021-07-29,Parks Equity Initiative - Fiscal 2022,2022,designate,,,Rivera City Parks Foundation,Council District 2,133561657,10000,DPR,846,006,,
1,2021-07-29,Parks Equity Initiative - Fiscal 2022,2022,designate,,,Rodriguez City Parks Foundation,Inwood Hill Park,133561657,10000,DPR,846,006,,
1,2021-07-29,Parks Equity Initiative - Fiscal 2022,2022,designate,,,Gibson City Parks Foundation,It's My Park - Community Programming,133561657,10000,DPR,846,006,,
1,2021-07-29,Parks Equity Initiative - Fiscal 2022,2022,designate,,,City Parks Foundation,Seeds to Trees - Middle School 390X (10X390) & School for Cabrera Environmental Citizenship (10X386),133561657,10000,DPR,846,006,,
1,2021-07-29,Parks Equity Initiative - Fiscal 2022,2022,designate,,,Perkins City Parks Foundation,Summer Stage and City Parks Play - Council District 9,133561657,20000,DPR,846,006,,
1,2021-07-29,Parks Equity Initiative - Fiscal 2022,2022,designate,,,City Parks Foundation,"Vesuvio Playground, Chelsea Park, Matthews-Palmer Playground, Johnson McCaffrey Park and Father Fagan Park",133561657,15000,DPR,846,006,,
1,2021-07-29,Parks Equity Initiative - Fiscal 2022,2022,designate,,,"Cornegy Council on the Environment, Inc.",,132765465,15000,DPR,846,006,,
1,2021-07-29,Parks Equity Initiative - Fiscal 2022,2022,designate,,,"Gibson Council on the Environment, Inc.",Council District 16,132765465,15000,DPR,846,006,,
1,2021-07-29,Parks Equity Initiative - Fiscal 2022,2022,designate,,,Moya Department of Parks and Recreation,,136400434,85000,DPR,846,006,,
1,2021-07-29,Parks Equity Initiative - Fiscal 2022,2022,designate,,,Rodriguez Department of Parks and Recreation,,136400434,10000,DPR,846,006,,
1,2021-07-29,Parks Equity Initiative - Fiscal 2022,2022,designate,,,Johnson Department of Parks and Recreation,,136400434,35000,DPR,846,006,,
1,2021-07-29,Parks Equity Initiative - Fiscal 2022,2022,designate,,,Ayala Department of Parks and Recreation,Cevita Garden,136400434,10000,DPR,846,006,,
1,2021-07-29,Parks Equity Initiative - Fiscal 2022,2022,designate,,,Perkins Department of Parks and Recreation,City Parks Movies & Concerts,136400434,10000,DPR,846,006,,
1,2021-07-29,Parks Equity Initiative - Fiscal 2022,2022,designate,,,Rivera Department of Parks and Recreation,City Parks Worker,136400434,15000,DPR,846,006,,
1,2021-07-29,Parks Equity Initiative - Fiscal 2022,2022,designate,,,Riley Department of Parks and Recreation,Council District 12 Parks,136400434,55000,DPR,846,006,,
1,2021-07-29,Parks Equity Initiative - Fiscal 2022,2022,designate,,,Gibson Department of Parks and Recreation,Council District 16,136400434,20000,DPR,846,006,,
1,2021-07-29,Parks Equity Initiative - Fiscal 2022,2022,designate,,,Rivera Department of Parks and Recreation,Council District 2 - Parks Improvements,136400434,20000,DPR,846,006,,
1,2021-07-29,Parks Equity Initiative - Fiscal 2022,2022,designate,,,Gennaro Department of Parks and Recreation,Council District 24 - Family Days,136400434,45000,DPR,846,006,,
1,2021-07-29,Parks Equity Initiative - Fiscal 2022,2022,designate,,,Powers Department of Parks and Recreation,Council District 4 - Tree Guards,136400434,30000,DPR,846,006,,
1,2021-07-29,Parks Equity Initiative - Fiscal 2022,2022,designate,,,Brannan Department of Parks and Recreation,Council District 43,136400434,85000,DPR,846,006,,
1,2021-07-29,Parks Equity Initiative - Fiscal 2022,2022,designate,,,Rose Department of Parks and Recreation,Council District 49,136400434,45000,DPR,846,006,,
