category,agencies,initiative,amount
ANTI-POVERTY,,Multiple Anti-Poverty Initiative,2800000
BOROUGHWIDE NEEDS,,Multiple Boroughwide Needs Initiative,2000000
COMMUNITY DEVELOPMENT,"DYCD, CUNY",AAPI Community Support,5060000
COMMUNITY DEVELOPMENT,"DYCD, CUNY, NYPL, QBPL",Adult Literacy Initiative,4000000
COMMUNITY DEVELOPMENT,DYCD,Adult Literacy Pilot Project,2500000
COMMUNITY DEVELOPMENT,DYCD,Communities of Color Nonprofit Stabilization Fund,3700000
COMMUNITY DEVELOPMENT,"DYCD, DCLA, DFTA, DOE, QBPL",Digital Inclusion and Literacy Initiative,4590000
COMMUNITY DEVELOPMENT,DYCD,"Diversity, Inclusion and Equity in Tech Initiative",700000
COMMUNITY DEVELOPMENT,"CUNY, DLCA, DYCD",LGBTQIA+ Community Services,4405625
COMMUNITY DEVELOPMENT,"DOHMH, DYCD",Trans Equity Programs,3225000
COMMUNITY SAFETY AND VICTIM SERVICES,,Multiple Community Safety and Victim Services Initiative,5100000
CRIMINAL JUSTICE SERVICES,MOCJ,Alternatives to Incarceration (ATI),14487000
CRIMINAL JUSTICE SERVICES,DYCD,Discharge Planning,350000
CRIMINAL JUSTICE SERVICES,DYCD,Diversion Programs,2525000
CRIMINAL JUSTICE SERVICES,"ACS, DYCD",Initiative to Combat Sexual Assault,4160000
CRIMINAL JUSTICE SERVICES,"DYCD, DOP,DABK",Innovative Criminal Justice Programs,2637948
CRIMINAL JUSTICE SERVICES,DYCD,Support for Victims of Human Trafficking,1075000
CRIMINAL JUSTICE SERVICES,,"DYCD, H+H Supports for Persons Involved in the Sex Trade",3476697
CULTURAL ORGANIZATIONS,DCLA,Coalition Theaters of Color,5715000
CULTURAL ORGANIZATIONS,"DCLA, DYCD, CUNY",Cultural After-School Adventure (CASA),17340000
CULTURAL ORGANIZATIONS,"DCLA, DYCD, CUNY, DOE",Cultural Immigrant Initiative,7395000
CULTURAL ORGANIZATIONS,DCLA,Ghetto Film School (GFS) Accelerator Program Model,75000
CULTURAL ORGANIZATIONS,DCLA,SU-CASA,3825000
DOMESTIC VIOLENCE SERVICES,"MOCJ, DAQN, DASI, NYPD",Domestic Violence and Empowerment (DoVE) Initiative,12010000
DOMESTIC VIOLENCE SERVICES,"ACS, HRA, DYCD",Supportive Alternatives to Violent Encounters (SAVE),2450000
EDUCATION,"DYCD, BPL, NYPL, QPL",City’s First Readers,5449667
EDUCATION,DOE,College and Career Readiness,1740000
EDUCATION,DOE,Community Schools,3750000
EDUCATION,DOE,Education Equity Action Plan,5000000
EDUCATION,DOE/DYCD,Educational Programs for Students,7143133
EDUCATION,DYCD,Jill Chaifetz Helpline,500000
EDUCATION,DOE/DYCD,LGBTQIA+ Inclusive Curriculum (Formerly Known as LGBTQ Inclusive Curriculum),2800000
EDUCATION,DOE/DYCD,Physical Education and Fitness,925000
EDUCATION,DOE,Social and Emotional Supports for Students,2016500
EDUCATION,DOE,Support for Arts Instruction,4000000
EDUCATION,DOE,Support for Educators,4400000
ENVIRONMENTAL INITIATIVES,"DYCD, DCLA, DOE, DOT, DPR, HPD, SBS",A Greener NYC,5100000
ENVIRONMENTAL INITIATIVES,"DYCD, DCLA, DOE, DPR, DSNY, SBS",NYC Cleanup,14280000
FOOD INITIATIVES,CUNY/DYCD,Access to Healthy Food and Nutritional Education,2133750
FOOD INITIATIVES,DSS/HRA,Food Access and Benefits,1500000
FOOD INITIATIVES,CUNY/DYCD,Food Pantries,7260000
HEALTH SERVICES,DOHMH,Abortion Access Fund,850000
HEALTH SERVICES,DOHMH,Access Health,3620210
HEALTH SERVICES,DOHMH,Cancer Services,743908
HEALTH SERVICES,DOHMH,Child Health and Wellness,664719
HEALTH SERVICES,,"DOHMH, DSS/HRA, CUNY, H+H Ending the Epidemic",9373342
HEALTH SERVICES,DOHMH,HIV/AIDS Faith Based,1966311
HEALTH SERVICES,DOHMH,Maternal and Child Health Services,3728525
HEALTH SERVICES,DOHMH,Managed Care Consumer Assistance Program,953787
HEALTH SERVICES,DOHMH,Reproductive & Sexual Health Services,554423
HEALTH SERVICES,DOHMH,Viral Hepatitis Prevention,2247454
HIGHER EDUCATION INITIATIVES,CUNY,Care Workers for Our Future,400000
HIGHER EDUCATION INITIATIVES,CUNY,Creative Arts Team (CUNY CAT),400000
HIGHER EDUCATION INITIATIVES,CUNY,CUNY Childcare Expansion,600000
HIGHER EDUCATION INITIATIVES,CUNY,CUNY Diversity Incubator,500000
HIGHER EDUCATION INITIATIVES,CUNY,CUNY Research Institutes,4500000
HIGHER EDUCATION INITIATIVES,CUNY,CUNY School of Labor and Urban Studies (SLU),1200000
HIGHER EDUCATION INITIATIVES,"CUNY, DOE",Peter F. Vallone Academic Scholarship,16411869
HOMELESS SERVICES,DHS,Children and Families in NYC Homeless System,1350000
HOMELESS SERVICES,HRA,Citywide Homeless Prevention Fund,820000
HOUSING,HPD,Community Housing Preservation Strategies,3651000
HOUSING,"HPD, CUNY",Community Land Trust,1500000
HOUSING,"HPD, DCWP",Financial Empowerment for NYC Renters,450000
HOUSING,HPD,Foreclosure Prevention Programs,4150000
HOUSING,HPD,Home Loan Program,1800000
HOUSING,DSS/HRA,Housing Court Answers,650000
HOUSING,HPD,Housing Information Project,300000
HOUSING,HPD,Stabilizing NYC,3700000
IMMIGRANT SERVICES,"CUNY, DYCD",CUNY Citizenship NOW! Program,3350000
IMMIGRANT SERVICES,,"DOHMH, H+H Immigrant Health Initiative",2430341
IMMIGRANT SERVICES,HRA/CUNY,Immigrant Opportunities Initiative,2600000
IMMIGRANT SERVICES,DYCD,Key to the City,700000
IMMIGRANT SERVICES,HRA,New York Immigrant Family Unity Project,16600000
IMMIGRANT SERVICES,DSS/HRA,Unaccompanied Minors and Families,3981800
IMMIGRANT SERVICES,DYCD,Welcome NYC,1175000
LEGAL SERVICES,DYCD,Family Advocacy and Guardianship Support,3000000
LEGAL SERVICES,MOCJ,Legal Information and Support for Families,485000
LEGAL SERVICES,DSS/HRA,Legal Services for Low-Income New Yorkers,5800000
LEGAL SERVICES,DSS/HRA,Legal Services for the Working Poor,3455000
LEGAL SERVICES,DSS/HRA,Low Wage Worker Support,2173000
LEGAL SERVICES,DYCD,Prisoners’ Rights Project,1000000
LIBRARIES,BPL,Fiscal 2024 Subsidy,4380300
LIBRARIES,NYPL,Fiscal 2024 Subsidy,5840400
LIBRARIES,QPL,Fiscal 2024 Subsidy,4380300
LIBRARIES,,Research Fiscal 2024 Subsidy,1099000
MENTAL HEALTH SERVICES,"DOHMH, DCLA",Autism Awareness,3261846
MENTAL HEALTH SERVICES,DOHMH,Children Under Five,1556231
MENTAL HEALTH SERVICES,DOHMH,Court-Involved Youth Mental Health,3425000
MENTAL HEALTH SERVICES,DOHMH,"Developmental, Psychological & Behavioral Health Services",2255493
MENTAL HEALTH SERVICES,DOHMH,Geriatric Mental Health,3405540
MENTAL HEALTH SERVICES,DOHMH,LGBTQIA Youth All-Borough Mental Health,1200000
MENTAL HEALTH SERVICES,DOHMH,Mental Health Services for Vulnerable Populations,3663000
MENTAL HEALTH SERVICES,CUNY,Mental Health Workforce Retention and Development,250000
MENTAL HEALTH SERVICES,DOHMH,Opioid Prevention and Treatment,3075000
MENTAL HEALTH SERVICES,DOHMH,Trauma Recovery Centers,2400000
OLDER ADULT SERVICES (FORMERLY SENIOR SERVICES),DFTA,Access to Critical Services for Older Adults (formerly Access to Critical Services for Seniors),1180000
OLDER ADULT SERVICES (FORMERLY SENIOR SERVICES),DFTA,Borough Presidents’ Discretionary Funding Restoration,1129774
OLDER ADULT SERVICES (FORMERLY SENIOR SERVICES),DFTA,Case Management,2000000
OLDER ADULT SERVICES (FORMERLY SENIOR SERVICES),DFTA,Elder Abuse Prevention Programs,335000
OLDER ADULT SERVICES (FORMERLY SENIOR SERVICES),DFTA,Elie Wiesel Holocaust Survivors,4200000
OLDER ADULT SERVICES (FORMERLY SENIOR SERVICES),DFTA,Information and Referral Services,407811
OLDER ADULT SERVICES (FORMERLY SENIOR SERVICES),DFTA,LGBTQIA+ Older Adult Services in Every Borough (formerly LGBTQ Senior Services in Every Borough),1755000
OLDER ADULT SERVICES (FORMERLY SENIOR SERVICES),DFTA,Naturally Occurring Retirement Communities (NORCs),5181768
OLDER ADULT SERVICES (FORMERLY SENIOR SERVICES),DFTA,Older Adult Clubs for Immigrant Populations (formerly Senior Centers for Immigrant Populations),1500000
OLDER ADULT SERVICES (FORMERLY SENIOR SERVICES),DFTA,"Older Adult Clubs, Programs, and Enhancements (formerly Senior Centers, Programs, and Enhancements)",2145415
OLDER ADULT SERVICES (FORMERLY SENIOR SERVICES),DFTA,Social Adult Day Care,1505556
OLDER ADULT SERVICES (FORMERLY SENIOR SERVICES),"CUNY, DFTA, DCLA",Support Our Older Adults (formerly Support Our Seniors),7650000
PARKS AND RECREATION SERVICES,"DCLA, DYCD",Art a Catalyst for Change,720000
PARKS AND RECREATION SERVICES,"DOE, DOP, DYCD, HHC",Crisis Management System,3770600
PARKS AND RECREATION SERVICES,DYCD,Cure Hate,125000
PARKS AND RECREATION SERVICES,"CUNY, DYCD",Hate Crimes Prevention Initiative,1225000
PUBLIC SAFETY,SBS,Chamber on the Go and Small Business Assistance,2252267
PUBLIC SAFETY,SBS,Construction Site Safety Training,1100000
PUBLIC SAFETY,CUNY,Create New Technology Incubators,1400000
PUBLIC SAFETY,SBS,Day Laborer Workforce Initiative,3970000
PUBLIC SAFETY,SBS,Domestic Worker and Employer Empowerment,300000
PUBLIC SAFETY,SBS,Five Borough Chamber Alliance,500000
PUBLIC SAFETY,DYCD,Green Jobs Corps Program,120000
PUBLIC SAFETY,SBS/DYCD,Job Training and Placement Initiative,8450000
PUBLIC SAFETY,SBS,Made in NYC,850000
PUBLIC SAFETY,SBS,MWBE Leadership Associations,600000
PUBLIC SAFETY,"SBS, DYCD, DCLA",Neighborhood Development Grant Initiative,2550000
PUBLIC SAFETY,SBS,Pride at Work,501000
PUBLIC SAFETY,SBS,Support for Immigrant and Women Workers,600000
PUBLIC SAFETY,SBS/CUNY,Worker Cooperative Business Development Initiative,3768208
SMALL BUSINESS SERVICES AND WORKFORCE DEVELOPMENT,,Multiple Speaker’s Initiative to Address Citywide Needs,47822020
SPEAKER’S INITIATIVE TO ADDRESS CITYWIDE NEEDS,HRA,Homeless Prevention Services for Veterans,340000
SPEAKER’S INITIATIVE TO ADDRESS CITYWIDE NEEDS,SBS/DYCD,Job Placement for Veterans,200000
SPEAKER’S INITIATIVE TO ADDRESS CITYWIDE NEEDS,HRA,Legal Services for Veterans,600000
SPEAKER’S INITIATIVE TO ADDRESS CITYWIDE NEEDS,DOHMH,Mental Health Services for Veterans,420000
SPEAKER’S INITIATIVE TO ADDRESS CITYWIDE NEEDS,DYCD/DCLA/CUNY/DOHMH,Veterans Community Development,1270000
VETERAN SERVICES,DOHMH,Dedicated Contraceptive Fund,973126
VETERAN SERVICES,HRA,HRA Teen RAPP,250000
VETERAN SERVICES,DYCD,Initiative for Immigrant Survivors of Domestic Violence,530000
VETERAN SERVICES,DYCD,Prevent Sexual Assault (PSA) Initiative for Young Adults,350000
VETERAN SERVICES,DYCD,Step In and Stop It Initiative to Address Bystander Intervention,174000
VETERAN SERVICES,DOE,Work-Based Learning Internships,714500
VETERAN SERVICES,ACS,Wrap-Around Support for Transitional-Aged Foster Youth,1096788
VETERAN SERVICES,DYCD,Young Women’s Leadership Development,1740500
YOUNG WOMEN’S INITIATIVE,"DYCD, DCLA",Afterschool Enrichment Initiative,8235000
YOUNG WOMEN’S INITIATIVE,DYCD,Big Brothers Big Sisters of New York City,1200000
YOUNG WOMEN’S INITIATIVE,DYCD,Citywide Young Adult Entrepreneurship Program Initiative,1000000
YOUNG WOMEN’S INITIATIVE,DYCD,Civic Education in New York City Schools,500000
YOUNG WOMEN’S INITIATIVE,DYCD,COMPASS,1870048
YOUNG WOMEN’S INITIATIVE,DYCD,Sports Training and Rolemodels for Success Initiative (STARS),1472000
YOUNG WOMEN’S INITIATIVE,DYCD,YouthBuild Project Initiative,1750000
