resolution,date,chart,fiscal_year,action,source,council_member,organization,program,ein,amount,agency,agy_num,ua,purpose,flags
1,2018-07-18,Digital Inclusion and Literacy Initiative - Fiscal 2019,2019,designate,,,"Rosenthal Older Adults Technology Services (OATS), Inc.",Computer classes for Seniors - Council District 6,550882599,30000,DYCD,260,005,,
1,2018-07-18,Digital Inclusion and Literacy Initiative - Fiscal 2019,2019,designate,,,"Treyger Opportunities for a Better Tomorrow, Inc.",Coney Island Adult Education,112934620,40000,DYCD,260,005,*,
1,2018-07-18,Digital Inclusion and Literacy Initiative - Fiscal 2019,2019,designate,,,Treyger United Chinese Association of Brooklyn,,371469112,20000,DYCD,260,005,*,
1,2018-07-18,Digital Inclusion and Literacy Initiative - Fiscal 2019,2019,designate,,,"Vallone Coalition for Queens, Inc.",Queens Tech Meetup & Entrepreneurship,611652332,20000,DYCD,260,005,,
1,2018-07-18,Digital Inclusion and Literacy Initiative - Fiscal 2019,2019,designate,,,"Vallone Selfhelp Community Services, Inc.",Clearview Senior Cente,131624178,40000,DYCD,260,005,*,
1,2018-07-18,Digital Inclusion and Literacy Initiative - Fiscal 2019,2019,designate,,,"Yeger Agudath Israel of America Community Services, Inc.",Brookdale Senior Center,133975090,20000,DYCD,260,005,*,
1,2018-07-18,Digital Inclusion and Literacy Initiative - Fiscal 2019,2019,designate,,,Yeger Boro Park Jewish Community Council,,113475993,20000,DYCD,260,005,*,
1,2018-07-18,Digital Inclusion and Literacy Initiative - Fiscal 2019,2019,designate,,,"Yeger SBH Community Service Network, Inc.",,237406410,20000,DYCD,260,005,*,
1,2018-07-18,Digital Inclusion and Literacy Initiative - Fiscal 2019,2019,designate,,,"Grodenchik Older Adults Technology Services (OATS), Inc.",SNAP Senior Center in CD 23,550882599,20000,DYCD,260,005,*,
1,2018-07-18,Digital Inclusion and Literacy Initiative - Fiscal 2019,2019,designate,,,"Grodenchik Older Adults Technology Services (OATS), Inc.",SNAP Senior Center in CD 23,550882599,20000,DYCD,260,005,*,
1,2018-07-18,Digital Inclusion and Literacy Initiative - Fiscal 2019,2019,rescind,,,Department of Youth and Community Development,,136400434,-120000,DYCD,260,005,,**
1,2018-07-18,Digital Inclusion and Literacy Initiative - Fiscal 2019,2019,designate,,,Adams Queens Borough Public Library,,136400434,20000,QBPL,039,001,,**
1,2018-07-18,Digital Inclusion and Literacy Initiative - Fiscal 2019,2019,designate,,,Richards Queens Borough Public Library,"Far Rockaway, Laurelton & Rosedale Branches",136400434,20000,QBPL,039,001,*,**
1,2018-07-18,Digital Inclusion and Literacy Initiative - Fiscal 2019,2019,designate,,,Lancman Queens Borough Public Library,Council District 24,136400434,20000,QBPL,039,001,,**
1,2018-07-18,Digital Inclusion and Literacy Initiative - Fiscal 2019,2019,designate,,,Grodenchik Queens Borough Public Library,Digital Inclusion - CD23 libraries,136400434,20000,QBPL,039,001,*,**
1,2018-07-18,Digital Inclusion and Literacy Initiative - Fiscal 2019,2019,designate,,,Barron Brooklyn Public Library,"New Lots, East Flatbush, Spring Creek, Cypress: for Technology",136400434,40000,BPL,038,001,,**
1,2018-07-18,Healthy Aging Initiative - Fiscal 2019,2019,rescind,,,Department for the Aging,,136400434,-1349000,DFTA,125,003,,
1,2018-07-18,Healthy Aging Initiative - Fiscal 2019,2019,designate,,,"Ampry-Samuel God's Love We Deliver, Inc.",,133366846,10000,DFTA,125,003,*,
1,2018-07-18,Healthy Aging Initiative - Fiscal 2019,2019,designate,,,"Ampry-Samuel New York Road Runners, Inc.",,132949483,10000,DFTA,125,003,*,
1,2018-07-18,Healthy Aging Initiative - Fiscal 2019,2019,designate,,,"Ampry-Samuel Older Adults Technology Services (OATS), Inc.",,550882599,10000,DFTA,125,003,*,
1,2018-07-18,Healthy Aging Initiative - Fiscal 2019,2019,designate,,,"Ampry-Samuel SHARE: Self-Help for Women with Breast or Ovarian Cancer, Inc.",,133131914,10000,DFTA,125,003,*,
1,2018-07-18,Healthy Aging Initiative - Fiscal 2019,2019,designate,,,"Adams Jamaica Service Program for Older Adults (JSPOA), Inc.",Rockaway,510204121,20000,DFTA,125,003,*,
1,2018-07-18,Healthy Aging Initiative - Fiscal 2019,2019,designate,,,"Adams Rochdale Village Social Services, Inc.",,113397470,20000,DFTA,125,003,*,
1,2018-07-18,Healthy Aging Initiative - Fiscal 2019,2019,designate,,,"Ayala East Side House, Inc.",,131623989,20000,DFTA,125,003,,
1,2018-07-18,Healthy Aging Initiative - Fiscal 2019,2019,designate,,,"Ayala Union Settlement Association, Inc.",Council District 8,131632530,20000,DFTA,125,003,,
1,2018-07-18,Healthy Aging Initiative - Fiscal 2019,2019,designate,,,Barron East New York Restoration Local Development Corporation,Council District 42,461763706,40000,DFTA,125,003,,
1,2018-07-18,Healthy Aging Initiative - Fiscal 2019,2019,designate,,,"Borelli Jewish Community Center of Staten Island, Inc.",South Shore Senior Center,135562256,10000,DFTA,125,003,*,
1,2018-07-18,Healthy Aging Initiative - Fiscal 2019,2019,designate,,,"Borelli Staten Island Community Services Friendship Clubs, Inc.",Great Kills Friendship Club,132778244,15000,DFTA,125,003,*,
1,2018-07-18,Healthy Aging Initiative - Fiscal 2019,2019,designate,,,"Borelli Staten Island Community Services Friendship Clubs, Inc.",Mount Loretto Friendship Club,132778244,15000,DFTA,125,003,*,
1,2018-07-18,Healthy Aging Initiative - Fiscal 2019,2019,designate,,,"Brannan NIA Community Services Network, Inc.",,112697931,40000,DFTA,125,003,,
1,2018-07-18,Healthy Aging Initiative - Fiscal 2019,2019,designate,,,Cohen Jewish Association for Services for the Aged (JASA),Van Cortlandt Senior Center,132620896,20000,DFTA,125,003,,
1,2018-07-18,Healthy Aging Initiative - Fiscal 2019,2019,designate,,,"Cohen Regional Aid for Interim Needs, Inc.",Nereid Neighborhood Senior Center,136213586,15000,DFTA,125,003,*,
1,2018-07-18,Healthy Aging Initiative - Fiscal 2019,2019,designate,,,"Cohen Regional Aid for Interim Needs, Inc.",Tracey Towers,136213586,5000,DFTA,125,003,*,
1,2018-07-18,Healthy Aging Initiative - Fiscal 2019,2019,designate,,,"Constantinides Catholic Charities Neighborhood Services, Inc.",DellaMonica-Steinway Senior Center,112047151,12500,DFTA,125,003,*,
1,2018-07-18,Healthy Aging Initiative - Fiscal 2019,2019,designate,,,"Constantinides HANAC, Inc.",Douris Tower Healthy Aging,112290832,12990,DFTA,125,003,,
1,2018-07-18,Healthy Aging Initiative - Fiscal 2019,2019,designate,,,"Constantinides SHARE: Self-Help for Women with Breast or Ovarian Cancer, Inc.",Senior Support,133131914,14510,DFTA,125,003,*,
1,2018-07-18,Healthy Aging Initiative - Fiscal 2019,2019,designate,,,"Cumbo Circuit Productions, Inc.",,132881858,20000,DFTA,125,003,*,
1,2018-07-18,Healthy Aging Initiative - Fiscal 2019,2019,designate,,,"Cumbo Q Kingdom Ministries, Inc.",,113201956,20000,DFTA,125,003,*,
1,2018-07-18,Healthy Aging Initiative - Fiscal 2019,2019,designate,,,Deutsch Jewish Association for Services for the Aged (JASA),,132620896,10000,DFTA,125,003,,
1,2018-07-18,Healthy Aging Initiative - Fiscal 2019,2019,designate,,,"Deutsch Ohel Children's Home and Family Services, Inc.",,116078704,10000,DFTA,125,003,,
1,2018-07-18,Healthy Aging Initiative - Fiscal 2019,2019,designate,,,Deutsch Shaare Zion Congregation,,111735956,10000,DFTA,125,003,*,
1,2018-07-18,Healthy Aging Initiative - Fiscal 2019,2019,designate,,,"Deutsch Shorefront YM-YWHA of Brighton-Manhattan Beach, Inc.",,113070228,10000,DFTA,125,003,*,
1,2018-07-18,Healthy Aging Initiative - Fiscal 2019,2019,designate,,,"Diaz Bronx Jewish Community Council, Inc.",Council District 18,132744533,10000,DFTA,125,003,,
1,2018-07-18,Healthy Aging Initiative - Fiscal 2019,2019,designate,,,"Diaz Neighborhood Self Help by Older Persons Project, Inc.",Lafayette Estates,133077047,10000,DFTA,125,003,,
1,2018-07-18,Healthy Aging Initiative - Fiscal 2019,2019,designate,,,"Diaz New York Road Runners, Inc.",Council District 18,132949483,20000,DFTA,125,003,,
1,2018-07-18,Healthy Aging Initiative - Fiscal 2019,2019,designate,,,"Dromm Catholic Charities Neighborhood Services, Inc.",Catherine Sheridan Senior Center,112047151,14500,DFTA,125,003,*,
1,2018-07-18,Healthy Aging Initiative - Fiscal 2019,2019,designate,,,"Dromm India Home, Inc.",,208747291,14500,DFTA,125,003,*,
1,2018-07-18,Healthy Aging Initiative - Fiscal 2019,2019,designate,,,"Eugene Dorchester Senior Citizens Center, Inc.",,112305581,10000,DFTA,125,003,*,
1,2018-07-18,Healthy Aging Initiative - Fiscal 2019,2019,designate,,,"Eugene Fenimore Senior Center, Inc.",,112772287,10000,DFTA,125,003,*,
1,2018-07-18,Healthy Aging Initiative - Fiscal 2019,2019,designate,,,"Eugene Fort Greene Council, Inc.",,112300840,10000,DFTA,125,003,*,
1,2018-07-18,Healthy Aging Initiative - Fiscal 2019,2019,designate,,,Eugene St. Gabriel's Episcopal Church,,112463892,10000,DFTA,125,003,*,
1,2018-07-18,Healthy Aging Initiative - Fiscal 2019,2019,designate,,,"Gibson BronxWorks, Inc.",,133254484,13000,DFTA,125,003,*,
1,2018-07-18,Healthy Aging Initiative - Fiscal 2019,2019,designate,,,"Gibson Hope of Israel Senior Citizens Center, Inc.",,132749857,13000,DFTA,125,003,*,
1,2018-07-18,Healthy Aging Initiative - Fiscal 2019,2019,designate,,,"Gibson Presbyterian Senior Services, Inc.",Highbridge Senior Center,131981482,14000,DFTA,125,003,*,
1,2018-07-18,Healthy Aging Initiative - Fiscal 2019,2019,designate,,,Gjonaj Yeshiva University,Parnes Clinic,131624225,40000,DFTA,125,003,*,
1,2018-07-18,Healthy Aging Initiative - Fiscal 2019,2019,designate,,,"Holden Maspeth Town Hall, Inc.",Senior Programming,237259702,11500,DFTA,125,003,*,
1,2018-07-18,Healthy Aging Initiative - Fiscal 2019,2019,designate,,,"Holden Peter Cardella Senior Citizen Center, Inc.",,112328536,14250,DFTA,125,003,*,
1,2018-07-18,Healthy Aging Initiative - Fiscal 2019,2019,designate,,,"Holden Ridgewood Older Adult Center and Services, Inc.",,050607283,14250,DFTA,125,003,*,
1,2018-07-18,Healthy Aging Initiative - Fiscal 2019,2019,designate,,,"Johnson Penn South Social Services, Inc.",,133413349,20000,DFTA,125,003,*,
1,2018-07-18,Healthy Aging Initiative - Fiscal 2019,2019,designate,,,"Johnson Services and Advocacy for GLBT Elders (SAGE), Inc.",,132947657,10000,DFTA,125,003,*,
1,2018-07-18,Healthy Aging Initiative - Fiscal 2019,2019,designate,,,Johnson Westbeth Artists Residents Council,,133154253,10000,DFTA,125,003,*,
1,2018-07-18,Healthy Aging Initiative - Fiscal 2019,2019,designate,,,"Kallos Carter Burden Center for the Aging, Inc., The",Roosevelt Island Senior Center,237129499,10000,DFTA,125,003,,
1,2018-07-18,Healthy Aging Initiative - Fiscal 2019,2019,designate,,,"Kallos Carter Burden Center for the Aging, Inc., The",Upper East Side,237129499,10000,DFTA,125,003,,
1,2018-07-18,Healthy Aging Initiative - Fiscal 2019,2019,designate,,,"Kallos Lenox Hill Neighborhood House, Inc.",,131628180,10000,DFTA,125,003,,
1,2018-07-18,Healthy Aging Initiative - Fiscal 2019,2019,designate,,,"Kallos Stanley M. Isaacs Neighborhood Center, Inc.",,132572034,10000,DFTA,125,003,,
1,2018-07-18,Healthy Aging Initiative - Fiscal 2019,2019,designate,,,"Koo Charles B. Wang Community Health Center, Inc.",,132739694,25000,DFTA,125,003,,
1,2018-07-18,Healthy Aging Initiative - Fiscal 2019,2019,designate,,,Koo South Asian Council for Social Services,,113632920,15000,DFTA,125,003,*,
1,2018-07-18,Healthy Aging Initiative - Fiscal 2019,2019,designate,,,"Koslowitz Queens Community House, Inc.",Forest Hills NORC,112375583,20000,DFTA,125,003,,
1,2018-07-18,Healthy Aging Initiative - Fiscal 2019,2019,designate,,,"Koslowitz Young Israel Programs, Inc.",Young Israel of Forest Hills NSC,030381957,20000,DFTA,125,003,,
1,2018-07-18,Healthy Aging Initiative - Fiscal 2019,2019,designate,,,"Lancman Queens Community House, Inc.",,112375583,13333,DFTA,125,003,*,
1,2018-07-18,Healthy Aging Initiative - Fiscal 2019,2019,designate,,,Lancman South Asian Council for Social Services,,113632920,13333,DFTA,125,003,*,
1,2018-07-18,Healthy Aging Initiative - Fiscal 2019,2019,designate,,,"Lancman Young Israel Programs, Inc.",,030381957,13334,DFTA,125,003,*,
1,2018-07-18,Healthy Aging Initiative - Fiscal 2019,2019,designate,,,"Lander Heights and Hills, Inc.",Park Slope Center for Successful Aging,237237927,20000,DFTA,125,003,,
1,2018-07-18,Healthy Aging Initiative - Fiscal 2019,2019,designate,,,"Levine Riverstone Senior Life Services, Inc.",Riverstone Senior Center,133355074,20000,DFTA,125,003,,
1,2018-07-18,Healthy Aging Initiative - Fiscal 2019,2019,designate,,,"Levine West Side Federation for Senior and Supportive Housing, Inc.",Red Oak Senior Center,132926433,20000,DFTA,125,003,*,
1,2018-07-18,Healthy Aging Initiative - Fiscal 2019,2019,designate,,,Matteo Eger Health Care and Rehabilitation Center,,133524533,15000,DFTA,125,003,,
1,2018-07-18,Healthy Aging Initiative - Fiscal 2019,2019,designate,,,"Matteo Jewish Community Center of Staten Island, Inc.",,135562256,25000,DFTA,125,003,,
1,2018-07-18,Healthy Aging Initiative - Fiscal 2019,2019,designate,,,Menchaca Spanish Speaking Elderly Council,RAICES,112730462,10000,DFTA,125,003,*,
1,2018-07-18,Healthy Aging Initiative - Fiscal 2019,2019,designate,,,"Menchaca United Senior Citizens Center of Sunset Park, Inc.",,112358277,10000,DFTA,125,003,*,
1,2018-07-18,Healthy Aging Initiative - Fiscal 2019,2019,designate,,,"Miller Astoria/Queens Share-ing and Care-ing, Inc.",Allen Senior Center,113220371,10000,DFTA,125,003,,
1,2018-07-18,Healthy Aging Initiative - Fiscal 2019,2019,designate,,,Miller Hollis Presbyterian Church,Hollis Presbyterian Church,111631786,10000,DFTA,125,003,,
1,2018-07-18,Healthy Aging Initiative - Fiscal 2019,2019,designate,,,"Miller Merrill Park Civic Association of Springfield Gardens, Inc.",,112304928,10000,DFTA,125,003,,
1,2018-07-18,Healthy Aging Initiative - Fiscal 2019,2019,designate,,,Miller South Asian Council for Social Services,,113632920,10000,DFTA,125,003,,
1,2018-07-18,Healthy Aging Initiative - Fiscal 2019,2019,designate,,,"Perkins God's Love We Deliver, Inc.",,133366846,10000,DFTA,125,003,,
1,2018-07-18,Healthy Aging Initiative - Fiscal 2019,2019,designate,,,"Perkins New York Road Runners, Inc.",Weekly Walking and Wellness,132949483,10000,DFTA,125,003,,
1,2018-07-18,Healthy Aging Initiative - Fiscal 2019,2019,designate,,,"Perkins Older Adults Technology Services (OATS), Inc.",,550882599,10000,DFTA,125,003,,
1,2018-07-18,Healthy Aging Initiative - Fiscal 2019,2019,designate,,,"Perkins SHARE: Self-Help for Women with Breast or Ovarian Cancer, Inc.",,133131914,10000,DFTA,125,003,*,
1,2018-07-18,Healthy Aging Initiative - Fiscal 2019,2019,designate,,,"Powers Lenox Hill Neighborhood House, Inc.",,131628180,20000,DFTA,125,003,*,
1,2018-07-18,Healthy Aging Initiative - Fiscal 2019,2019,designate,,,"Powers New York Road Runners, Inc.",,132949483,20000,DFTA,125,003,,
1,2018-07-18,Healthy Aging Initiative - Fiscal 2019,2019,designate,,,Richards Jewish Association for Services for the Aged (JASA),JASA Brookdale,132620896,10000,DFTA,125,003,,
1,2018-07-18,Healthy Aging Initiative - Fiscal 2019,2019,designate,,,Richards Jewish Association for Services for the Aged (JASA),Roy Ruther Senior Center.,132620896,10000,DFTA,125,003,,
1,2018-07-18,Healthy Aging Initiative - Fiscal 2019,2019,designate,,,"Richards Merrill Park Civic Association of Springfield Gardens, Inc.",Robert Couche Senior Center,112304928,10000,DFTA,125,003,,
1,2018-07-18,Healthy Aging Initiative - Fiscal 2019,2019,designate,,,"Richards Services Now for Adult Persons (SNAP), Inc.",SNAP Brookville - Council District 31,112591783,10000,DFTA,125,003,,
1,2018-07-18,Healthy Aging Initiative - Fiscal 2019,2019,designate,,,"Rivera Good Old Lower East Side, Inc.",,132915659,40000,DFTA,125,003,,
1,2018-07-18,Healthy Aging Initiative - Fiscal 2019,2019,designate,,,"Rose Jewish Community Center of Staten Island, Inc.",,135562256,10000,DFTA,125,003,*,
1,2018-07-18,Healthy Aging Initiative - Fiscal 2019,2019,designate,,,"Rose Meals on Wheels of Staten Island, Inc.",,132894978,30000,DFTA,125,003,*,
1,2018-07-18,Healthy Aging Initiative - Fiscal 2019,2019,designate,,,Rosenthal Goddard Riverside Community Center,Meal Support,131893908,25000,DFTA,125,003,*,
1,2018-07-18,Healthy Aging Initiative - Fiscal 2019,2019,designate,,,"Rosenthal Neighborhood Self Help by Older Persons Project, Inc.",Virtual Classes - Council District 6,133077047,15000,DFTA,125,003,,
1,2018-07-18,Healthy Aging Initiative - Fiscal 2019,2019,designate,,,Jewish Association for Services for the Aged (JASA),Coney Island Active Aging (CIAA) NORC- Treyger SSP,132620896,13333,DFTA,125,003,*,
1,2018-07-18,Healthy Aging Initiative - Fiscal 2019,2019,designate,,,Treyger Jewish Association for Services for the Aged (JASA),Warbasse Cares NORC- SSP,132620896,13333,DFTA,125,003,*,
1,2018-07-18,Healthy Aging Initiative - Fiscal 2019,2019,designate,,,"Treyger Jewish Community Council of Greater Coney Island, Inc.",Haber House Senior Center,112665181,13334,DFTA,125,003,*,
1,2018-07-18,Healthy Aging Initiative - Fiscal 2019,2019,designate,,,"Vallone HANAC, Inc.",Angelo Petromelis Senior Center,112290832,20000,DFTA,125,003,,
1,2018-07-18,Healthy Aging Initiative - Fiscal 2019,2019,designate,,,"Vallone Samuel Field YM & YWHA, Inc.",,113071518,20000,DFTA,125,003,*,
1,2018-07-18,Healthy Aging Initiative - Fiscal 2019,2019,designate,,,"Grodenchik Catholic Charities Neighborhood Services, Inc.",,112047151,15000,DFTA,125,003,*,
1,2018-07-18,Healthy Aging Initiative - Fiscal 2019,2019,designate,,,"Grodenchik Samuel Field YM & YWHA, Inc.",,113071518,12500,DFTA,125,003,*,
1,2018-07-18,Healthy Aging Initiative - Fiscal 2019,2019,designate,,,"Grodenchik Selfhelp Community Services, Inc.",,131624178,12500,DFTA,125,003,*,
1,2018-07-18,Afterschool Enrichment Initiative - Fiscal 2019,2019,rescind,,,Department of Youth and Community Development,,136400434,-68907,DYCD,260,312,,
1,2018-07-18,Afterschool Enrichment Initiative - Fiscal 2019,2019,designate,,,Young Men's Christian Association of Greater New York,,131624228,50000,DYCD,260,312,,
1,2018-07-18,Afterschool Enrichment Initiative - Fiscal 2019,2019,designate,,,"Stanley M. Isaacs Neighborhood Center, Inc.",,132572034,18907,DYCD,260,312,,
1,2018-07-18,Court-Involved Youth Mental Health Initiative - Fiscal 2019,2019,rescind,,,"Good Shepherd Services, Inc.",,135598710,-83000,DHMH,816,120,,
1,2018-07-18,Court-Involved Youth Mental Health Initiative - Fiscal 2019,2019,designate,,,Good Shepherd Services,,135598710,83000,DHMH,816,120,,
1,2018-07-18,Court-Involved Youth Mental Health Initiative - Fiscal 2019,2019,rescind,,,Department of Health and Mental Hygiene,,136400434,-900000,DHMH,816,120,,
1,2018-07-18,Court-Involved Youth Mental Health Initiative - Fiscal 2019,2019,designate,,,"Child Center of New York, Inc., The",,111733454,65000,DHMH,816,120,,
1,2018-07-18,Court-Involved Youth Mental Health Initiative - Fiscal 2019,2019,designate,,,"Children's Aid Society, The",,135562191,100000,DHMH,816,120,,
1,2018-07-18,Court-Involved Youth Mental Health Initiative - Fiscal 2019,2019,designate,,,"Coalition for Behavioral Health, Inc., The",,132729071,60000,DHMH,816,120,,
1,2018-07-18,Court-Involved Youth Mental Health Initiative - Fiscal 2019,2019,designate,,,"Getting Out and Staying Out, Inc.",,061711370,50000,DHMH,816,120,,
1,2018-07-18,Court-Involved Youth Mental Health Initiative - Fiscal 2019,2019,designate,,,"Good Shepherd Services, Inc.",,135598710,67000,DHMH,816,120,,
1,2018-07-18,Court-Involved Youth Mental Health Initiative - Fiscal 2019,2019,designate,,,"Northside Center for Child Development, Inc.",,131656679,67000,DHMH,816,120,,
1,2018-07-18,Court-Involved Youth Mental Health Initiative - Fiscal 2019,2019,designate,,,"Osborne Association, Inc., The",,135563028,67000,DHMH,816,120,,
1,2018-07-18,Court-Involved Youth Mental Health Initiative - Fiscal 2019,2019,designate,,,Kingsbridge Heights Community Center,,132813809,90000,DHMH,816,120,,
1,2018-07-18,Court-Involved Youth Mental Health Initiative - Fiscal 2019,2019,designate,,,"EAC, Inc.",,237175609,90000,DHMH,816,120,,
1,2018-07-18,Court-Involved Youth Mental Health Initiative - Fiscal 2019,2019,designate,,,"Urban Youth Alliance International, Inc.",,132969182,150000,DHMH,816,120,,
1,2018-07-18,Court-Involved Youth Mental Health Initiative - Fiscal 2019,2019,designate,,,Richmond Medical Center,,743177454,94000,DHMH,816,120,,
1,2018-07-18,Mental Health Services for Vulnerable Populations - Fiscal 2019,2019,rescind,,,Department of Health and Mental Hygiene,,136400434,-95000,DHMH,816,120,,
1,2018-07-18,Mental Health Services for Vulnerable Populations - Fiscal 2019,2019,designate,,,"Children's Aid Society, The",,135562191,75000,DHMH,816,120,,
1,2018-07-18,Mental Health Services for Vulnerable Populations - Fiscal 2019,2019,designate,,,Association to Benefit Children,,133303089,20000,DHMH,816,120,,
1,2018-07-18,Community Housing Preservation Strategies - Fiscal 2019,2019,rescind,,,Housing Preservation and Development,,136400434,-61000,HPD,806,009,,
1,2018-07-18,Community Housing Preservation Strategies - Fiscal 2019,2019,designate,,,Margert Community Corporation,MCC Senior Homeowner Services,112534700,61000,HPD,806,009,,
1,2018-07-18,Community Housing Preservation Strategies - Fiscal 2019,2019,rescind,,,Housing Preservation and Development,,136400434,-29730,HPD,806,009,,
1,2018-07-18,Community Housing Preservation Strategies - Fiscal 2019,2019,designate,,,Urban Justice Center,,133442022,29730,HPD,806,009,,
1,2018-07-18,Adult Literacy Initiative - Fiscal 2019,2019,rescind,,,"Jacob A. Riis Neighborhood Settlement, Inc.",,111729398,-100000,DYCD,260,005,,
1,2018-07-18,Adult Literacy Initiative - Fiscal 2019,2019,designate,,,"Jacob A. Riis Neighborhood Settlement, The",,111729398,100000,DYCD,260,005,,
1,2018-07-18,Adult Literacy Initiative - Fiscal 2019,2019,rescind,,,Department of Youth and Community Development,,136400434,-185000,DYCD,260,005,,
1,2018-07-18,Adult Literacy Initiative - Fiscal 2019,2019,designate,,,"Sunset Park Health Council, Inc,",,202508411,100000,DYCD,260,005,,
1,2018-07-18,Adult Literacy Initiative - Fiscal 2019,2019,designate,,,"NIA Community Services Network, Inc.",,112697931,25000,DYCD,260,005,,
1,2018-07-18,Adult Literacy Initiative - Fiscal 2019,2019,designate,,,Women for Afghan Women,,020539734,10000,DYCD,260,005,,
1,2018-07-18,Adult Literacy Initiative - Fiscal 2019,2019,designate,,,"Liberian Cultural Association, Inc.",,550802603,25000,DYCD,260,005,,
1,2018-07-18,Adult Literacy Initiative - Fiscal 2019,2019,designate,,,"Lenox Hill Neighborhood House, Inc.",,131628180,25000,DYCD,260,005,,
1,2018-07-18,Community Schools - Fiscal 2019,2019,rescind,,,New York City Community Learning Schools,,461227433,-250000,DOE,040,454,,
1,2018-07-18,Educational Programs for Students - Fiscal 2019,2019,designate,,,"United Federation of Teachers Educational Foundation, Inc.",,139226721,250000,DOE,040,402,*,
1,2018-07-18,Art a Catalyst for Change - Fiscal 2019,2019,rescind,,,Department of Cultural Affairs,,136400434,-4000,DCLA,126,003,,
1,2018-07-18,Art a Catalyst for Change - Fiscal 2019,2019,designate,,,"Sundog Theatre, Inc.",,450476945,1000,DCLA,126,003,,
1,2018-07-18,Art a Catalyst for Change - Fiscal 2019,2019,designate,,,"2020 Vision for Schools, Inc.",,453023036,1000,DCLA,126,003,,
1,2018-07-18,Art a Catalyst for Change - Fiscal 2019,2019,designate,,,"Bronx Museum of the Arts, The",,132709368,1000,DCLA,126,003,,
1,2018-07-18,Art a Catalyst for Change - Fiscal 2019,2019,designate,,,"BRIC Arts Media Brooklyn, Inc.",,112547268,1000,DCLA,126,003,,
1,2018-07-18,Art a Catalyst for Change - Fiscal 2019,2019,rescind,,,"Man Up, Inc.",High School for Civil Rights,030553092,-18000,DCLA,126,003,,
1,2018-07-18,Art a Catalyst for Change - Fiscal 2019,2019,designate,,,"Man Up, Inc.",P.S. 149K,030553092,18000,DCLA,126,003,,
1,2018-07-18,Art a Catalyst for Change - Fiscal 2019,2019,rescind,,,"Man Up, Inc.",Academy for Young Writers,030553092,-18000,DCLA,126,003,,
1,2018-07-18,Art a Catalyst for Change - Fiscal 2019,2019,designate,,,Purelements: An Evolution in Dance,P.S. 325K - Fresh Creek School,205332584,18000,DCLA,126,003,,
1,2018-07-18,Chamber on the Go and Small Business Assistance - Fiscal 2019,2019,rescind,,,Department of Small Business Services,,136400434,-206000,SBS,801,002,,
1,2018-07-18,Chamber on the Go and Small Business Assistance - Fiscal 2019,2019,designate,,,Bronx Overall Economic Development Corporation,,133079387,68000,SBS,801,002,,
1,2018-07-18,Chamber on the Go and Small Business Assistance - Fiscal 2019,2019,designate,,,National Gay & Lesbian Chamber of Commerce,,134219714,40000,SBS,801,002,*,
1,2018-07-18,Chamber on the Go and Small Business Assistance - Fiscal 2019,2019,designate,,,"New Bronx Chamber of Commerce, The",,371443165,98000,SBS,801,002,,
1,2018-07-18,Coalition Theaters of Color - Fiscal 2019,2019,rescind,,,Department of Cultural Affairs,Coalition Theaters of Color,136400434,-44400,DCLA,126,003,,
1,2018-07-18,Coalition Theaters of Color - Fiscal 2019,2019,designate,,,"* Chinese Theatre Works, Inc.",,112393789,29800,DCLA,126,003,,
1,2018-07-18,Coalition Theaters of Color - Fiscal 2019,2019,designate,,,"Yangtze Repertory Theatre of America, Inc.",,133698610,14600,DCLA,126,003,*,
1,2018-07-18,Immigrant Health Initiative - Fiscal 2019,2019,rescind,,,Department of Health and Mental Hygiene,,136400434,-50000,DHMH,816,117,,
1,2018-07-18,Immigrant Health Initiative - Fiscal 2019,2019,designate,,,"* Grameen Primacare, Inc.",,463181224,50000,DHMH,816,117,,
1,2018-07-18,Made in NYC - Fiscal 2019,2019,rescind,,,Department of Small Business Services,,136400434,-100000,SBS,801,002,,
1,2018-07-18,Made in NYC - Fiscal 2019,2019,designate,,,Pratt Institute,,111630822,100000,SBS,801,002,,
1,2018-07-18,Opioid Prevention and Treatment - Fiscal 2019,2019,rescind,,,Department of Health and Mental Hygiene,,136400434,-650000,DHMH,816,120,,
