member,organization,program,ein,amount,agency,purpose
Narcisse,"Housing Court Answers, Inc.",Tenant Support - Council District 46,133317188,5000,DSS/HRA,"Funding to support provision of information and programming regarding housing rights, eviction/homelessness prevention services; and to conduct workshops and trainings in the community. Page 85 Appendix B: Local Initiatives Council Member Sponsor Legal Name of Organization - Program Name Tax ID Amount Agency Purpose of Funds"
Vernikov,"HSS Screening and Early Detection, Inc.",,473436880,10000,DHMH,Funds to cover costs of mobile screenings for cancer and other diseases.
Caban,"HSS Screening and Early Detection, Inc.",Cancer Screenings - Council District 22,473436880,5000,DHMH,"Funds will be used to provide health services, including cancer screenings in Council District 22."
Paladino,"HSS Screening and Early Detection, Inc.",Preventative Screening for Thyroid Cancer & Risk for Cancer,473436880,5000,DHMH,Funds will support cancer screening services.
De La Rosa,"HSS Screening and Early Detection, Inc.",Thyroid Cancer Screening - Council District 10,473436880,5000,DHMH,To support Thyroid Cancer screening in Council District 10.
Brannan,"HSS Screening and Early Detection, Inc.",Thyroid Cancer Screenings - Council District 47,473436880,10000,DHMH,To support thyroid cancer screening and prevention events & efforts in Council District 47.
Speaker,"Bottcher, Manhattan Hudson Guild",Teen and Young Adult Services,135562989,150000,DYCD,"Funding will support Hudson Guild's Teen Services program, which serves young people ages 14-24 with comprehensive education, career, and recreation services."
De La Rosa,"Hudson River Community Sailing, Inc.",Sail Academy In Inwood,261784215,5000,DYCD,To support HRCS Sail Academy in Council District 10.
Speaker,"Stevens Hunger Free America, Inc.",,133471350,50000,DSS/HRA,"Funding to support increased participation in SNAP, other nutrition assistance benefits and to assist low-income households citywide who remain eligible to retain benefits. Additionally, to provide technical assistance to food pantries and soup kitchens."
Stevens,"Hunger Free America, Inc.",Food Action Boards (FABs) - Council District 16,133471350,10000,DYCD,Funds will support outreach and community engagement with local residents on healthy food initiatives and support the Food Action Boards (FABs): groups of low- income individuals who are receiving training and knowledge on healthy food options.
Salamanca,Hunts Point Alliance for Children,,208503907,16000,DCLA,Funding will be used for programming and services
Osse,"I Hold the Key, Inc.",,833034480,20000,DYCD,Funding for community and cultural programming in Council District 36.
Powers,"Ice Theatre of New York, Inc.",,133258301,5000,DCLA,Funding will support Dancing on Ice! City Skate Performances and outreach programming in Council District 4.
Bottcher,"Ice Theatre of New York, Inc.","Funds for Dancing on Ice & outreach in Chelsea, targeting at-risk youth, and artistic skater classes",133258301,5000,DCLA,Funds would go towards supporting Ice Theatre space rentals and education programs.
Salaam,"Ice Theatre of New York, Inc.",New Works &Young Artists Series - Council District 9.,133258301,5000,DCLA,"Funding will expand ITNY's New Works and Young Artists Series, offering ice dance exposure and training to underserved youth in District 9."
Osse,"Ifetayo Cultural Arts Academy, Inc.",,113027538,5000,DCLA,Funding for youth cultural programming in Council District 36.
Speaker,"Joseph Ifetayo Cultural Arts Academy, Inc.",,113027538,80000,DYCD,"Funding to support Ifetayo's arts, social justice, youth ensemble, and other intellectual and emotional development programs."
Hanks,IlluminArt Productions,,421727647,5000,DCLA,Funding will support CII programming.
Vernikov,"Imeinu, Inc. dba Rachel's Place",,260774611,10000,DYCD,"Funds to cover costs and programming expenses for homeless young women, who have suffered from domestic violence."
Speaker,"Gennaro, Krishnan, Lee, Queens India Home, Inc.",,208747291,150000,DFTA,"To provide hot vegetarian and halal congregate meals, as well as exercise, physical therapy, and yoga sessions primarily in English, Hindi and Bengali to immigrant seniors in Queens."
Lee,"India Home, Inc.",Senior Programming,208747291,30000,DFTA,Funding to support senior programs in Council District 23.
Caban,"IndieSpace, Inc.",Consulting & Advising Program - Council District 22,474523884,5000,DCLA,To provide services to arts orgs based in Council District 22 including lease negotiations and space maintenance.
Bottcher,"Infirnity, Inc.","Gatherings, Leadership & Opportunity",473498240,5000,DYCD,Funds to provide programming for current and former residents of the Elliot-Chelsea NYCHA Community. Page 86 Appendix B: Local Initiatives Council Member Sponsor Legal Name of Organization - Program Name Tax ID Amount Agency Purpose of Funds
Restler,"Institute for Community Living, Inc.",Mental Health Supports for Youth and Young Adults - Council District 33,133306195,5000,DHMH,"Funding to support mental health services including housing, rehabilitation, recovery and case management in Council District 33."
Carr,Integrated Athletic Initiative Corp,,873354678,5000,DYCD,Funds to be used for operational and athletic sports programming for youth.
Hanif,"Interfaith Center of New York, Inc., The",Council District 39,133926970,5000,DYCD,Funds will be used to organize events that support faith leaders in serving immigrant New Yorkers in Council District 39.
De La Rosa,"Internal Creations, Inc.",Guitar Music Programming - Council District 10,471831397,5000,DYCD,To support music programming in Council District 10.
Carr,International Aphasia Movement,,593842242,5000,DYCD,Funds to be used for operating costs and programming.
Rivera,International Aphasia Movement,,593842242,5000,DYCD,Funds will support programs and operations.
Zhuang,"International Cultural Exchange Center, Inc.",Community Cultural Programming,872089597,5000,DYCD,Funding for community cultural programming in Council District 43.
Gutierrez,"International Studio & Curatorial Program, Inc.",Public Arts Programs- District 34,205052686,10000,DCLA,"Funding will support free public visual arts programs, residencies for New York City- based artists, and high school visitation program."
Holden,"Intrepid Museum Foundation, Inc.",Council District 30,133062419,20000,DCLA,Funds will support a STEM after-school program within Council District 30.
De La Rosa,"Inwood Art Works, Inc.",Film Works Alfresco,814379932,10000,DCLA,To support Inwood Art Works Outdoor Cinema series programming.
Salaam,"Iris House: A Center for Women Living with HIV, Inc.",Council District 9,133699201,10000,DYCD,"To provide fresh, nutritious food to underserved residents through weekly distributions, supporting food security for thousands of individuals and families in Council District 9."
Hudson,"Irondale Productions, Inc.","To Protect, Serve & Understand (TPSU) - Council District 35",133178772,5000,DCLA,Funding for theatrical programming relating to NYPD and community relations in Council District 35.
De La Rosa,"Isham Park Restoration Program 1970, Inc.",Inwood Jazz Festival,811703530,5000,DCLA,To Support the programming and operations of the Inwood Jazz Festival.
Williams,"Islamic Circle of North America, Inc.",Council District 27,112925751,5000,DYCD,Funds will be used to support organizational expenses and food pantry in Council District 27.
Restler,"ISSUE Project Room, Inc.",Public Performance Events - Council District 33,200367608,5000,DCLA,"To support public performance events in Council District 33 that span the disciplines of music, dance, literature, film, and performance - highlighting innovative artists whose creative achievements remain under-recognized."
Holden,"Italian Charities of America, Inc.",Events and Programs - Council District 30,111666830,10000,DYCD,Funds to support Italian and Italian American cultural events and programs in Council District 30.
Ariola,"Itty Bitty City Kitties, Inc.",Mobile Veterinary Clinic - Council District 32,854284614,5000,DYCD,Funds will help support the launch of a Mobile Veterinary Clinic in Council District 32.
Krishnan,Jackson Heights Beautification Group,,112925587,10000,DYCD,"To fund musical programs, newsletter, tree-care and environmental sustainability programs, dog park/run, and graffiti removal."
Won,"Jacob A. Riis Neighborhood Settlement, The",Case Management Services - Council District 26,111729398,22000,DYCD,"Funds will be used to support education programming, case management, and other services."
Caban,"Jacob A. Riis Neighborhood Settlement, The",ESOL & Case Management,111729398,11000,DYCD,"Funds will be used to support education programming, case management, and other services for immigrant populations in Council District 22."
Brewer,"Jake Foundation, Inc.",Summer Soccer - Council District 6,462418234,5000,DYCD,Funds will support a Summer Soccer Program for at risk youth in Council District 6.
Williams,"Jamaica Center for Arts and Learning, Inc.",Council District 27,112478709,15000,DCLA,"Funds will be used to support festivals, Black History Month, and ARTWorks programming in Council District 27."
Lee,"Jamaica Estates Holliswood South Bayside Volunteer Ambulance Corp, Inc.",,237351959,10000,FDNY,Funding to support general operating expenses related to volunteer ambulance brigade.
Powers,"Japan Society, Inc.",,131675082,5000,DCLA,Funding will support free cultural programming for retirement communities in New York City’s District 4. Page 87 Appendix B: Local Initiatives Council Member Sponsor Legal Name of Organization - Program Name Tax ID Amount Agency Purpose of Funds
Brewer,"Jazz at Lincoln Center, Inc.",Middle School Jazz Academy,133888641,5000,DCLA,Funds will support Jazz at Lincoln Center Middle School Jazz Academy.
Speaker,"De La Rosa Jazz Drama Program, The",,061722131,25000,DCLA,To cover general programming and operational expenses of Council District 10 programs.
De La Rosa,"Jazz Drama Program, The",Council District 10,061722131,10000,DCLA,To support Jazz Power youth programming in Council District 10.
Salaam,"Jazzmobile, Inc.",Council District 9,132614483,10000,DYCD,"To support free, high-quality jazz programs by funding artist fees, marketing, and production costs, ensuring cultural accessibility and community engagement in District 9."
Brewer,"Jazzmobile, Inc.",Mobile Concert Series - Council District 6,132614483,5000,DYCD,Funds will support Jazzmobile's free mobile concert series.
Narcisse,"JBI International, Inc.",Recapturing Reading for Visually Impaired or Blind,131683279,5000,DFTA,Funding to support services/programming for visually impaired/blind senior citizens including the library for the blind and outreach.
Hanks,Jeremiah Program,,411801834,10000,DYCD,Funding will support economic mobility programming for North Shore Single Mother Students in Council District 49.
Powers,Jewish Association for Services for the Aged (JASA),,132620896,5000,DFTA,"Funding will be used to continue to educate older adults, staff and social work students through advocacy workshops."
Speaker,Jewish Association for Services for the Aged (JASA),,132620896,30000,DFTA,"To provide funding support for social services, health support and recreational/educational activities to promote successful aging in place."
Speaker,Jewish Association for Services for the Aged (JASA),Home Delivered Meals,132620896,75000,DFTA,To provide funding support for the home delivered meals program.
Speaker,Jewish Association for Services for the Aged (JASA),Leap Elder Justice Program,132620896,50000,DFTA,Funding will be used to provide legal services to victims of domestic violence and elder abuse.
Abreu,Jewish Association for Services for the Aged (JASA),RNA House NORC,132620896,5000,DFTA,Funds will support supportive services and programs at RNA House NORC.
Lee,"Jewish Board of Family and Children's Services, Inc.",,135564937,5000,DHMH,Funding to support the provision of mental health services in Council District 23.
De La Rosa,"Jewish Board of Family and Children's Services, Inc.",Mental Health Services - Council District 10,135564937,5000,DHMH,To support the Jewish Board's programming for mental health services in Council District 10.
Narcisse,"Jewish Board of Family and Children's Services, Inc.",Mental Health Services - Council District 46,135564937,5000,DHMH,Funding to provide mental health services to underserved constituents in Council District 46.
Hanks,"Jewish Board of Family and Children's Services, Inc.",Mental Health Services - Council District 49,135564937,10000,DHMH,Funds will support mental health services in the 49th Council District.
Abreu,"Jewish Board of Family and Children's Services, Inc.",Mental Health Services - Council District 7,135564937,5000,DHMH,Funding to support mental health services in Council District 7.
Menin,"Jewish Board of Family and Children's Services, Inc.",One Call Center,135564937,5000,DHMH,"To support the One Call Center and hotline for referrals and clinic services, publicly noticed through Council District 5 monthly newsletter and website."
Louis,Jewish Child Care Association of New York,Council District 45,131624060,5000,DYCD,"Funding to support Back to School events, Community Baby Showers, community forums, holiday and other cultural events in Council District 45."
Restler,"Jewish Coalition for Youth Education & Support, Inc.",Council District 33,273152656,15000,DYCD,Funds to support JC YES Activities in Council District 33.
Brewer,"Jewish Community Center in Manhattan, Inc., The",D3 Open Arms Coalition,133490745,5000,DHMH,Funds will be used to support the D3 Open Arms Coalition.
Carr,"Jewish Community Center of Staten Island, Inc.",,135562256,5000,DYCD,"Funding will cover an array of critical support services including supportive counseling, case management, benefits and entitlements screening and enrollment, legal services and financial counseling."
Carr,"Jewish Community Center of Staten Island, Inc.",Sunrise Camp,135562256,5000,DYCD,Funds to be used to help support Summer Camp operational costs and programming. Page 88 Appendix B: Local Initiatives Council Member Sponsor Legal Name of Organization - Program Name Tax ID Amount Agency Purpose of Funds
Vernikov,"Jewish Community Center of Staten Island, Inc.",Sunrise Day Camp,135562256,5000,DYCD,"Funds to support Sunrise Day Camp's Operational, Transportation and Programming costs."
Banks,"Jewish Community Council of Canarsie, Inc.",Community Programming - Council District 42,112608645,5000,DYCD,"Funds will be used to support community development, event programming, and local initiatives that enhance quality of life for residents in Council District 42."
Banks,"Jewish Community Council of Canarsie, Inc.",Council District 42,112608645,40000,DYCD,"Funds to support access to healthy food and nutritional education, and economic security programming, senior trips and more in Council District 42."
Narcisse,"Jewish Community Council of Canarsie, Inc.",Council District 46,112608645,8500,DYCD,Funding to provide programming and social services and activities in Council District 46.
Joseph,"Jewish Community Council of Greater Coney Island, Inc.",Crown Heights Career Hub - Council District 40,112665181,5000,DYCD,Funding to support the Crown Heights Career Hub.
Zhuang,"Jewish Community Council of Greater Coney Island, Inc.",Nonprofit Help Desk,112665181,12500,DYCD,Funding to support the costs associated with providing Non-Profit Support Services.
Vernikov,"Jewish Community Council of Greater Coney Island, Inc.",Not Profit Help Desk,112665181,5000,DYCD,Funding will be used to offer free workshops and office hours to organizations in areas including the NYC Council Discretionary Grant process.
Brooks-Powers,"Jewish Community Council of the Rockaway Peninsula, Inc.",Council District 31,112425813,25000,DYCD,"Funding to support programming and services, such as Medicare assistance, case management for seniors, and emotional support programming through the arts. Additionally, providing emotional support programming for youth following the October 7 attacks."
Abreu,Jewish Home Lifecare Manhattan,Geriatrics Career Development - Council District 7,131624033,10000,DFTA,Funding to support the Geriatrics Career Development Program in Council District 7.
Schulman,Jewish Institute of Queens,Emergency Food Program,542068797,29500,DYCD,To support the emergency food program which provides food pantry bags to those in need and in Council District 29.
Menin,Jewish Museum,,136146854,5000,DCLA,"Funding to support Family Day Festivals, including concerts from popular children's entertainers, scavenger hunts and tours in the galleries publicly noticed through Council District 5 monthly newsletter and website."
Marmorato,Jewish Museum,Council District 13,136146854,10000,DCLA,To facilitate programming between the Jewish Museum and children with disabilities in Council District 13.
Powers,Jewish Museum,Family Day Festivals,136146854,5000,DCLA,"Funding will support the Jewish Museum's multi-generational Family Day programs, which include interactive and intergenerational art activities, collaborative creative workshops, family tours and musical performances."
Bottcher,Jewish Museum,High School of Fashion Industries (02M600) & Public School 051M Elias Howe School (02M051),136146854,10000,DCLA,To support Movies That Matter Partnerships and Art Partnerships with High School of Fashion Industries (HSFI) and PS51 Elias Howe School.
Menin,"Jewish Orthodox Women's Medical Association, Inc.",,841743835,5000,DHMH,Funds would be used for health-related programming for Council District 5.
Narcisse,"Jewish Orthodox Women's Medical Association, Inc.",Council District 46,841743835,5000,DHMH,Funds to provide health services and programming to Council District 46.
Louis,"Joseph Prison to Palace Program, Inc.",Pickleball Bi- Weekly Clinics,851603288,5000,DYCD,Funding will provide training and skill building in the sport of pickleball and to create a social community that supports family.
Joseph,"J'Ouvert City International, Inc.",Council District 40,113362754,5000,DYCD,"Funds to support expenses associated with Parade, Labor Day J’Ouvert activities which includes, steelbands and masquerade performances and Awards celebration and other operational expenses."
Hudson,"J'Ouvert City International, Inc.",Education & Cultural Activities,113362754,5000,DYCD,Funding to support the costs associated with J'Ouvert celebrations. Page 89 Appendix B: Local Initiatives Council Member Sponsor Legal Name of Organization - Program Name Tax ID Amount Agency Purpose of Funds
Bottcher,"Joyce Theater Foundation, Inc.",Subsidized Tickets - JoycePass,133038262,7500,DCLA,Funds will be used to support subsidized tickets to performances at the Joyce Theater.
Mealy,"Juneteenth NYC, Inc.",Black Kings - Council District 41,873965180,10000,DYCD,"Funds will be used to support The Black Kings Awards, an event dedicated to honoring the often overlooked contributions of Black men in our community."
Louis,"Juneteenth NYC, Inc.",Black Kings Celebration & Juneteenth Events - Council District 45,873965180,5000,DYCD,Funds to support the Black Kings Celebration and Juneteenth Events in Council District 45.
Adams,Junior Achievement of New York,Financial Literacy - Council District 28,133031828,8000,DYCD,Funds will support in school time financial literacy program.
Schulman,Junior Achievement of New York,Forest Hills High School,133031828,5000,DYCD,"To promote and teach Financial Literacy, Entrepreneurship and Work Readiness at Forest Hills High School."
Holden,"Juniper Valley Park Conservancy, Inc.",Community Programs in Smaller Neighborhood Parks - Council District 30,593791952,20000,DYCD,To support community programming in smaller neighborhood parks as well as the work of park and garden volunteer groups.
Banks,"JustFix, Inc.",Tenant Rights Programming - Council District 42,813080695,5000,HPD,Funds will be used to do programming to help improve tenant rights in the 42nd Council District.
Brewer,"JustFix, Inc.","Who Owns What, Tenant App & Eviction Free NY",813080695,5000,HPD,Funding to support the provision of tools and trainings to tenants so that they will be better equipped to exercise their housing rights.
Gennaro,"Justice Innovation, Inc.",,852810883,7500,DYCD,"Funding will go to Queens Youth Justice Center's Queens Engagement Strategies for Teens (QUEST), the first of NYC’s alternative-to-detention programs, combining social services and youth development programming with supervision and court monitoring."
Speaker,"Bronx, Stevens Justice Innovation, Inc.",Bronx Community Solutions,852810883,75000,DYCD,Funding will be used for the Center for Court Innovation's Bronx Community Solutions (BCS) Initiative which improves neighborhood conditions.
Louis,"Justice Innovation, Inc.",Brooklyn Mental Health Court Program - Council District 45,852810883,5000,DYCD,Funds to be used for Brooklyn Mental Health Court program in Council District 45.
Stevens,"Justice Innovation, Inc.",Center for Court Innovation's - Bronx Community Solutions (BCS) Initiative - Council District 16,852810883,10000,DYCD,"Funding will be used for the Center for Court Innovation's Bronx Community Solutions (BCS) Initiative which improves neighborhood conditions, funds will be used for supplies and community service projects in Council District 16."
Ayala,"Justice Innovation, Inc.",Harlem Community Justice Center,852810883,5000,DYCD,To provide support for programming of the Harlem Community Justice Center.
Speaker,"Justice Innovation, Inc.",Midtown Community Justice Center: Community First,852810883,40000,DYCD,Funding will support the Community First homeless outreach program.
Brewer,"Justice Innovation, Inc.",Midtown Community Justice Center: Community Justice Initiative,852810883,5000,DYCD,Funds will support community engagement events and community-based programs.
Adams,"Justice Innovation, Inc.",Queens Community Justice Center,852810883,10000,DYCD,"Funds will support alternative to detention services, including social services and youth development programming."
Speaker,"Zhuang Justice Innovation, Inc.",RISE Project,852810883,50000,DYCD,"To provide funding support to effectively serve the Chinese-speaking communities Brooklyn, Manhattan, and Queens, training a person to become proficient in Chinese, and then deploy them to these areas to provide language support or other services."
Aviles,"Justice Innovation, Inc.",Youth Program,852810883,10000,DYCD,Funds for the Red Hook Community Justice Center (Justice Center) support for Youth Impact program.
De La Rosa,"Kan Cobra Tiger Alliance, Inc.",,463766464,5000,DYCD,To support Community Programming in Council District 10. Page 90 Appendix B: Local Initiatives Council Member Sponsor Legal Name of Organization - Program Name Tax ID Amount Agency Purpose of Funds
Mealy,"Kan Cobra Tiger Alliance, Inc.",Council District 41 & Mt. Ararat Senior Center,463766464,5000,DYCD,"Funds will be used for recreational and activities, lunchtime prevention activities and community events to educate Seniors on current events with newspapers & Senior violence."
Ayala,"Keep Rising to the Top, Inc.",Community Dance Program,133948379,14000,DCLA,To provide funds for KR3T'S Community Dance Program.
Schulman,"Kew Gardens Council for Recreation and the Arts, Inc.",WE'RE TOGETHER - Kew Gardens,112556658,5000,DYCD,"Funding will be used to help support the following events: Kew Gardens Community Arts Day, Kids Art in the Park, Kew Gardens Planting Day and events at the Kew Gardens Community Center."
Brooks-Powers,"Kickers Youth Sports Association of Southeast Queens, Inc.",Council District 31,112988905,10000,DYCD,"Funding to support youth programming, including team sports activities, in Council District 31."
Krishnan,"Kinding Sindaw Heritage Foundation, Inc.",,472655890,5000,DCLA,Funds will be used to cover administrative/operation expenses for programming.
Joseph,"Kindred Enterprises Foundation, Inc.",Baking & Pastry Arts Program,884112174,5000,DYCD,Funds will be used for Inclusive Baking and Pastry Arts Program.
Speaker,"King Manor Association of Long Island, Inc.",,112396324,80000,DCLA,To provide funding support for in person and virtual field trips and educational programming.
Speaker,"King of Kings Foundation, Inc.",,030583790,50000,DYCD,"Funds will support targeted programming for high need/risk populations, including mentoring and community events in Council District 28."
Brooks-Powers,"King of Kings Foundation, Inc.",Council District 31,030583790,8000,DYCD,Funding to support community events and programming in Council District 31.
Speaker,"King of Kings Foundation, Inc.",Positive Impact Movement Mentoring Program,030583790,60000,DYCD,"Funds will be used to enhance the ""Positive Impact Movement (PIM) Mentoring Program"" and ""Anti-Drug-Anti-Gang Warriors Tour Program"" by making them more available to schools, community centers, recreational centers, libraries and youth detention centers."
Louis,"Kings Against Violence Initiative, Inc.",Hospital-Based Violence Interruption Program - Council District 45,811626947,5000,DYCD,Funds will be used for hospital-based violence interruption program in Council District 45.
Narcisse,"Kings Bay YM-YWHA, Inc.",ESOL/CIVICS Classes,113068515,20000,DYCD,Funding to support ESOL/CIVICS preparation classes to immigrants residing in the community.
Vernikov,"Kings Bay YM-YWHA, Inc.",Food Pantry,113068515,5000,DYCD,The funds will be utilized to enhance and grow the client-choice Food Pantry at the Kings Bay Y.
