member,organization,program,ein,amount,agency,purpose
Restler,84th Precinct Community Council,,113149257,5000,DYCD,To support the operations of the 84th Precinct Community Council.
Adams,"1 World Expo, Inc.",,813891758,5000,DYCD,To support civic education and programming in Council District 28.
Adams,"100 Suits for 100 Men, Inc.",,462971279,10000,DFTA,Funds will provide services for seniors in Rochdale Village within Council District 28.
Ung,109th Precinct Community Council,National Night Out Against Crime,112417336,8000,DYCD,Funding will be used to host community events with Police and Community.
Moya,"110th Precinct Community Council, Inc.",National Night Out - Council District 21,432025653,5000,DYCD,Funds will be used to support the National Night Out event in Council District 21.
Joseph,1199 SEIU Employer Child Care Corporation,Career Services - Council District 40,134063281,7000,DYCD,"Funds will be used to support wrap around services designed to expose WF2 participant to college and career readiness programming including college preparation and career counseling, workforce development for youth and academic skills enhancement."
Louis,1199 SEIU Employer Child Care Corporation,Council District 45,134063281,5000,DYCD,Funds will support Emergency Child Care Relief For Healthcare Workers in Council District 45.
Sanchez,1199 SEIU Employer Child Care Corporation,Future of America Learning Center (FALC),134063281,5000,DYCD,Funds will be used to support Future of America Learning Center's science fair event including supplies and curriculum for students leading up to the event.
Joseph,1199 SEIU Employer Child Care Corporation,The Anne Shore Sleep-Away Camp Program - Council District 40,134063281,5000,DYCD,Funds will be used for The Anne Shore Sleep-Away Camp Program contracts with 23 independently owned and operated camps that offer 1- to 4-week sleep away programming.
Hanks,121st Police Precinct Community Council,Council District 49,463856711,7000,DYCD,Funding will support community programs and services in Council District 49.
Joseph,360 Academic Sports Academy,Council District 40,852677647,5000,DYCD,"Funding will support a free year-around athletic training and academic support and enrichment program, including a six-week full day summer camp and our school year afterschool and Saturday program."
Bottcher,42nd Street Workshop,New Play Development,133763953,5000,DCLA,"Funds will support New Play Development includes Workshop Writers Intensives, Workshop LABs, Words Matter, private writer's meetings, and Out of The Hat."
Bottcher,"52nd Street Project, Inc., The",Arts Education & Youth Development Programming,133467948,5000,DCLA,To support arts and youth development programs.
Narcisse,61 Precinct Community Council,,992517566,7500,DYCD,Funding to provide youth programming and recreational activities in South Brooklyn.
Narcisse,69th Precinct Clergy Council,Unity in the Community - Council District 46,463745556,5000,DYCD,Funding to support community events and youth programming and youth explorer program.
Mealy,"77th Precinct Community Council, Inc.",,113463183,30000,DYCD,Funds will support transportation expenses for youth.
Paladino,"A Better College Point Civic Association, Inc.",College Point Civic Association,871091395,7500,DYCD,Funds will support the events and services for the College Point community.
Williams,"A Better Jamaica, Inc.",Jamaica Reads,113804421,10000,DCLA,Funds are used to support operational expenses of the Jamaica Reads in-school tutoring program.
Marmorato,"A Blend of Services, Inc.",Council District 13,454371145,5000,DYCD,"Funding will support grocery giveaways, career-readiness, and youth enrichment programs in Council District 13."
Hanks,A Chance In Life,Council District 49,131835632,10000,DYCD,Funding will support the youth center and community services in Council District 49.
Marte,"ABC No Rio, Inc.",,133171739,5000,DCLA,Funds will support program and operations for ABC No Rio zine fair and website.
Zhuang,Academy of Medical and Public Health Services,,272206293,10000,DYCD,Funds will be used to support service and programs in Council District 43. Page 27 Appendix B: Local Initiatives Council Member Sponsor Legal Name of Organization - Program Name Tax ID Amount Agency Purpose of Funds
Narcisse,"Access Justice Brooklyn, Inc.",Council District 46,113155182,7500,DYCD,Funds to provide legal counseling and workshops for homeowners in Council District 46.
Krishnan,"Accompany Capital, Inc.",,810584343,7500,SBS,"To fund services to micro and small businesses in Queens including webinars, and technical assistance to process applications for grants and loans."
Speaker,Rivera Ackerman Institute for the Family,Gender and Family Project,131923959,50000,DYCD,Funding to support the expenses associated with The Gender and Family Project.
Powers,"Adamah, Inc.",,432080719,5000,DYCD,Funds would be used to help students with programming such as street clean ups for Council District 4.
Dinowitz,"Adamah, Inc.",Environmental Justice - Council District 11,432080719,5000,DYCD,Funding to support environmental justice programming in Council District 11.
Bottcher,"Adaptive Design Association, Inc.",Adapt for Access - Custom Assistive Equipment for Students with Disabilities,134170232,5000,DHMH,Funds will provide adaptations and educational experiences to the P138M network of schools.
Krishnan,Adhikaar for Human Rights and Social Justice,,203384725,14000,DYCD,"To fund immigration services, adult literacy classes, and programming expansion due to increased caseloads in response to COVID-19."
Speaker,Krishnan Adhikaar for Human Rights and Social Justice,,203384725,50000,DYCD,"Funds will be used to provide critical, language-accessible, and culturally component direct services to the Nepali-speaking community, such as case management support, adult and digital literacy classes, and workforce development trainings."
Banks,"African American Women In Cinema Organization, Inc.",Cinema Program & Filmmaking - Council District 42,134151020,5000,DYCD,Funds will support the Cinema Program and Filmmaking for students and residents of Council District 42.
Salaam,"African Communities Together, Inc.",,461689772,5000,DYCD,"To provide case management and navigation support to immigrant New Yorkers, helping them access vital services and overcome barriers due to language, cultural differences, and increased immigration enforcement."
Hudson,"African Voices Communications, Inc.",Artistic Programs - Council District 35,133687018,5000,DCLA,Funding for general operating support to provide artistic programs for low-income and fixed income residents in Brooklyn.
Salaam,"African Voices Communications, Inc.",Reel Sisters' Film Programs,133687018,5000,DCLA,"To support Reel Sisters' film programs by funding artistic fees, honorariums, marketing, and production costs, fostering opportunities for women of color filmmakers in Harlem."
Louis,"African Voices Communications, Inc.",Reel Sisters of the Diaspora Film Festival & Lecture Series - Council District 45,133687018,5000,DCLA,Funds will support the Reel Sisters of the Diaspora Film Festival & Lecture Series in Council District 45.
Salaam,Afrikana Corporation,,932592894,5000,DYCD,Funds to be used to provide services to older adults and youth.
Stevens,Afrikana Corporation,Council District 16,932592894,10000,DYCD,Funds will be used to support operational costs and community engagement in Council District 16.
Gutierrez,"Afro-Latin Jazz Alliance of New York, Inc.",Afterschool Programs - Public School 120K (14K120) & Public School 132K Conselyea School (14K132),453665976,5000,DCLA,Funding will support afterschool for Public School 120K (14K120) & Public School 132 The Conselyea School (14K132).
Mealy,"Afro-Latin Jazz Alliance of New York, Inc.",Council District 41,453665976,10000,DCLA,Funds will support programming and services in Council District 41.
Vernikov,"Agudath Israel of America Community Services, Inc.",,133975090,5000,DYCD,"Funding to support education, career counseling and job services, family support, social services, legal needs and referrals to unemployed or under employed individuals. Page 28 Appendix B: Local Initiatives Council Member Sponsor Legal Name of Organization - Program Name Tax ID Amount Agency Purpose of Funds"
Ariola,"Agudath Israel of America Community Services, Inc.",Council District 32,133975090,5000,DYCD,"Funds will be used for educational programming, job training and career counseling services to unemployed and low income families."
De La Rosa,"AhHa!Broadway, Inc.",Spectacular Seniors - Council District 10,852492020,5000,DYCD,To support AhHa! Broadway Programming in Council District 10.
Rivera,"Aid for Life International, Inc.",,833055037,5000,DYCD,Funding will support Aid for Life's programs and operations.
Rivera,"AIDS Service Center of Lower Manhattan, Inc.",Alliance for Positive Change,133562071,5000,DHMH,Funds will support Alliance for Positive Change's programs and operations.
Bottcher,"AIDS Service Center of Lower Manhattan, Inc.",Food Access Programs,133562071,5000,DHMH,Funding will support the Food and Nutrition Services (FNS) Peer Coaching program.
Powers,"AIDS Service Center of Lower Manhattan, Inc.",Patients Access to Health - Council District 4,133562071,5000,DHMH,Funding will support program costs of Patients Access to Health in Council District 4.
Riley,"AIMHigh Empowerment Institute, Inc.",Mentorship Program - Council District 12,813143733,50000,DYCD,Funds to be used to operate the AIMHigh Empowerment Institute and all related programming.
Paladino,"AKTINA Productions, Inc.",English Speaking Greek Radio & TV,113220961,5000,DOITT,Funding will support public service and commercial free community programming.
Caban,"AKTINA Productions, Inc.",Greek Television Program - Council District 22,113220961,5000,DOITT,To support television programming that promotes Greek culture in New York City and outreach efforts specific to Council District 22.
Carr,Albanian American Association of Staten Island Inc.,,931542543,15000,DYCD,"Funds to be used for operating costs, events and programming."
Speaker,"Carr, Hanks Albanian-American Association of Ulqin, Inc.",,881042164,15000,DYCD,"Funds to be used for education programming, operational costs and events to teach culture, language and Albanian traditions."
Aviles,"Alex House Project, Inc., The",,475488301,20000,DHMH,Funds to support work development programming for new highly vulnerable parents.
Speaker,"Brannan Alfadila Community Services, Inc.",Youth Wellness and Inclusion Programming,851299761,20000,DYCD,"To support youth wellness and inclusion programming that integrates general and special needs children, including basketball program."
Speaker,Caban Ali Forney Center,Drop-In Center,300104507,50000,DYCD,Funding to support Ali Forney Center’s Emergency Housing Program Transitional Housing Program and Drop-In Center for Homeless LGBTQ Youth.
Williams,Allen A.M.E. Housing Corp,,112600290,16000,DYCD,"Funding will be used for programmatic staffing and planning, office supplies/equipment, and program supplies/equipment."
Adams,"Allen Community Senior Citizens Center, Inc.",Allen Rockaway Blvd Senior Center,112326244,9500,DFTA,"Funding is to support virtual and IT services, recreational and nutritional programming and staff at the senior center."
Brooks-Powers,Allen Neighborhood Preservation & Development Corporation,Council District 31,112705085,7500,DFTA,Funding will support in-person and virtual district-based senior services in Council District 31.
Paladino,"Alley Pond Environmental Center, Inc.",Environmental Education for All,112405466,5000,DCLA,The funding will be used to cover the various costs associated with implementing APEC's educational programs.
Speaker,"Lee Alley Pond Environmental Center, Inc.",Environmental Education for All,112405466,250000,DCLA,The funding will be used to cover the various costs associated with implementing APECs educational programs.
Speaker,"Brannan Alliance for Coney Island, Inc.",,460802042,100000,DYCD,"Funds will support small business support, public events, cultural programming, and community beautification in Council District 47."
Bottcher,"Alliance of Resident Theatres/New York, Inc.",,132768583,5000,DCLA,To provide comprehensive support services producers and artist members.
Hudson,"Alliance of Resident Theatres/New York, Inc.",Removing Financial Burdens for NYC Theatres - Council District 35,132768583,5000,DCLA,"Funding to support the Access A.R.T./New York program, which provides nonprofit theaters with tools to help them reach and serve more physically and developmentally disabled and neuro-diverse individuals."
Rivera,"Allied Productions, Inc.",Le Petit Versaille,133123525,5000,DCLA,Funds will support programs including Le Petit Versaille garden programs and operations. Page 29 Appendix B: Local Initiatives Council Member Sponsor Legal Name of Organization - Program Name Tax ID Amount Agency Purpose of Funds
Ariola,"Allied Veterans Memorial Committee of Ridgewood and Glendale, Inc.",Memorial Day Parade,383853340,2500,DVS,"Funds to be used for the annual Memorial Day Parade including bands, reviewing stands, transportation, publicity and other supplies."
Holden,"Allied Veterans Memorial Committee of Ridgewood and Glendale, Inc.",Memorial Day Parade - Council District 30,383853340,2500,DVS,"Funds to be used for the annual Memorial Day Parade including bands, reviewing stands, transportation, publicity and other supplies."
Louis,Alopecian Beauty Co,Haircare & Wellness Hub Program - Council District 45,823132682,5000,DYCD,"Funds will be used to educate women on haircare, advancing health and wellness and autoimmune disease research and community engagement programs in Council District 45."
Schulman,Alphapointe,General Programming for the Visually Impaired,440552486,10000,DYCD,To support Alphapointe's vision rehabilitation services as well as employment and overall skill development programming.
Menin,"Alvin Ailey Dance Foundation, Inc.",,132584273,5000,DCLA,Funds will support Physical dance choreography with seniors at Stanley Isaacs and other locations within Council District 5.
Bottcher,"Alvin Ailey Dance Foundation, Inc.",Dance Classes for Seniors - Manhattan Plaza,132584273,5000,DCLA,Funds will support Actors Fund AileyDance Classes for Seniors at Manhattan Plaza.
Brewer,"Alvin Ailey Dance Foundation, Inc.",Youth Dance Program,132584273,5000,DCLA,Funds will bring dance to New York City public school children.
Marte,Alzheimers Disease and Related Disorders Association,"New York City, Inc.",133277408,5000,DFTA,"Funds will be used to support community outreach, education and awareness of the MAWSP program and CaringKind's free programs of care and support to families caring for a person with Alzheimer's or a related dementia."
Menin,American Composers Orchestra,Talent Unlimited High School (02M519),132838450,5000,DCLA,Funds will be used to partner with Talent Unlimited HS for after school program or during school hours music program.
Joseph,"American Council Of Minority Women, Inc.",Council District 40,270861591,6000,DYCD,"Funding will support food distribution, health seminars, and community events."
Mealy,"American Council Of Minority Women, Inc.",Food Pantry - Council District 41,270861591,5000,DYCD,Funds will be used to support food pantry services.
Mealy,"American Council Of Minority Women, Inc.",Health Seminar - Council District 41,270861591,5000,DYCD,Funds will be used to host the seminars in Council District 41.
Narcisse,"American Debate League, Inc.",,471624385,10000,DYCD,"Funds will be used to provide youth speech, debate, leadership programs and activities throughout the year and summer for school district 17, 18 and 22."
Dinowitz,"American Debate League, Inc.",Speech & Debate Program - Council District 11,471624385,5000,DYCD,Funding to support schools debate programming in Council District 11.
Riley,"American Debate League, Inc.",Youth Debate Program - Council District 12,471624385,5000,DYCD,Funds to be used to support debate programming in Council District 12.
Brewer,American Folk Art Museum,Museum Career Internship Program,131985627,5000,DCLA,Funds will support the Museum's professional development internship program for youth.
Powers,American Kennel Club Museum of the Dog,,431485438,5000,DYCD,"Funding will support educational programming for youth and families at the AKC Museum of the Dog including its ""Paws to Read"" program, informational events, and adoption events."
Salaam,"American Legion Post 398 Colonel Charles Young, Inc.",,136272129,7000,DVS,"To support the operational costs of American Legion Post 398, ensuring continued community support for veterans, their families, and the Harlem community through essential services and charitable activities."
Brewer,American Museum of Natural History,Discovery Days Program - Council District 6,136162659,5000,DCLA,Funds will support family science program for Council District 6 NYCHA families. Page 30 Appendix B: Local Initiatives Council Member Sponsor Legal Name of Organization - Program Name Tax ID Amount Agency Purpose of Funds
Schulman,"American Pakistani Advocacy Group Cares, Inc.",Community Adequate Relief Empowerment Services (CARES) Program,851997635,5000,DYCD,"To support programming that provides food security, educational, cultural, health, and recreational activities for immigrants and community members in Council District 29."
Osse,American Pakistani Education Foundation,,815342754,5000,DYCD,Funding for American Pakistani Education Foundation's programming.
Hanif,"American Youth Soccer Academy for Bangladeshis, Inc.",,273722921,7500,DYCD,"Funding to support youth sports programming expenses such as gear, venue rental, and coaching staff."
Powers,American-Italian Cancer Foundation,,133035711,5000,DHMH,Funding will support free mammograms and clinical breast exams for economically disadvantaged women in Council District 4.
Vernikov,American-Italian Cancer Foundation,,133035711,5000,DHMH,"Funding will support programming, outreach and community events."
Gennaro,American-Italian Cancer Foundation,,133035711,6500,DHMH,Funds will support the Mammogram Bus in Council District 24 to provide patient navigation services to constituents.
Schulman,American-Italian Cancer Foundation,"Breast Cancer Outreach, Education & Navigation Initiative",133035711,5000,DHMH,Funds to bring Mammogram Bus to District 29 and provide patient navigation services to constituents.
Brewer,American-Italian Cancer Foundation,"Breast Cancer Outreach, Education & Navigation Program",133035711,5000,DHMH,"Funding will support Breast Cancer Outreach, Education and Navigation Program."
Ung,American-Italian Cancer Foundation,"Breast Cancer Outreach, Education & Navigation Program - Council District 20",133035711,5000,DHMH,Funding to be used for free mobile mammography services in Council District 20.
Narcisse,American-Italian Cancer Foundation,Breast Cancer Screening - Council District 46,133035711,12000,DHMH,Funding to support breast cancer screening events in Council District 46.
Brannan,American-Italian Cancer Foundation,Breast Cancer Screenings - Council District 47,133035711,5000,DHMH,To support free breast cancer screening events in Council District 47.
Abreu,American-Italian Cancer Foundation,Breast Cancer Screenings - Council District 7,133035711,12000,DHMH,Funding to support breast cancer screenings in Council District 7.
Sanchez,American-Italian Cancer Foundation,Cancer Screening & Outreach - Council District 14,133035711,5000,DHMH,To support accessible cancer screening and outreach in Council District 14.
Lee,American-Italian Cancer Foundation,Council District 23,133035711,5000,DHMH,To help fund no-cost breast cancer screening in Council District 23.
Joseph,American-Italian Cancer Foundation,Council District 40,133035711,7000,DHMH,Funding will support four breast cancer screening van events in Council District 40.
Menin,American-Italian Cancer Foundation,Mobile Care Clinic - Council District 5,133035711,10000,DHMH,"To support no-cost breast cancer screening and education services on a Mobile Care Clinic at locations in City Council District 5 including but not limited to NYCHA developments, senior and community centers, and publicly noticed."
Powers,"Amigos Del Museo Del Barrio, Inc.",,237156720,5000,DCLA,Funding will support El Museo's bilingual partnership program at a school in Council District 4.
Speaker,"Ayala Amigos Del Museo Del Barrio, Inc.",,237156720,150000,DCLA,To provide funding support for cultural enrichment programming for Council District 08.
Ayala,"Amigos Del Museo Del Barrio, Inc.",Community Engagement & Programming - Council District 8,237156720,5000,DCLA,To provide funding for El Museo's local community engagement and educational activities.
Menin,"Amigos Del Museo Del Barrio, Inc.",Council District 5,237156720,5000,DCLA,To support bilingual partnership program that focuses on schools and community organizations and artist-in-residency programs including visits to El Museo by schools in Council District 5.
Narcisse,"Amity Little League, Inc.",,112705385,5000,DYCD,"Funding to support operational expenses including purchasing baseball equipment, field maintenance, utilities and insurance costs. Page 31 Appendix B: Local Initiatives Council Member Sponsor Legal Name of Organization - Program Name Tax ID Amount Agency Purpose of Funds"
Gennaro,"Amudim Community Resources, Inc.",,470984801,5000,DYCD,"Funding will help cover the cost of an additional case manager who will provide services to individuals/family units; providing comprehensive case management for issues relating to drugs, mental health and sexual abuse."
Lee,"Amudim Community Resources, Inc.",Council District 23,470984801,5000,DYCD,Funds to support community services for Council District 23 and its residents.
Speaker,"Irish An Claidheamh Soluis, Inc.",,510244834,50000,DCLA,To fund programs promoting Irish arts and culture.
Powers,"An Claidheamh Soluis, Inc.",Irish Arts Center,510244834,5000,DCLA,Funding will support programming and events at the Irish Arts Center.
Moya,Animal Care and Control of New York City,Community Pets & Community Kids Programs - Council District 21,133788986,10000,DHMH,To support community pets events in Council District 21 as well as Community Kids programs for Council District 21 youth.
Marmorato,Animal Care and Control of New York City,Council District 13,133788986,10000,DHMH,Funds will be used for pet food giveaways and spay/neuter events in Council District 13.
Farias,Animal Care and Control of New York City,Council District 18,133788986,10000,DHMH,"Funding to support outreach programming, surrender prevention, and community pets in Council District 18."
Zhuang,Animal Care and Control of New York City,Ending Animal Homelessness - Council District 43,133788986,5000,DHMH,"Funds to support the mobile adoption center, spay and neuter clinic in Council District 43."
Bottcher,Animal Care and Control of New York City,Humane Outreach Programming,133788986,5000,DHMH,"Funds will be used to support programs to end animal homelessness and Humane Outreach Programming including Surrender Prevention, Community Pets, Community Kids and Enrichment."
Paladino,Animal Care and Control of New York City,Surrender Prevention & Community Events,133788986,7500,DHMH,Funds will support Keeping Families Together: Surrender Prevention and Community Pets programming and services.
Hanif,"Annual Gowanus Artists Studio Tour, Inc.",,753192120,5000,DCLA,"Funds will support staff and outreach to promote art events in Gowanus including ""Gowanus Open Studios"" and/or other events where the public has an opportunity to interact with art."
Speaker,"Queens Ansob Center for Refugees, Inc.",,113534833,50000,DYCD,Funds will be used to support legal services for immigrants and refugees.
Caban,"Ansob Center for Refugees, Inc.",Immigration Legal Services Program - Council District 22,113534833,25000,DYCD,Funding will be used to provide counseling to immigrant and refugee communities in Council District 22.
Rivera,APICHA Community Health Center,,133706365,5000,DHMH,Funds will support programs and operations.
Krishnan,APICHA Community Health Center,,133706365,9000,DHMH,To support the provision of comprehensive health services and specifically to support staff to conduct community health education.
Speaker,Caban APICHA Community Health Center,,133706365,40000,DHMH,To provide funding support for the Apicha CHC Access to Healthcare Initiative.
Ung,APICHA Community Health Center,Apicha Community Health Center - Council District 20,133706365,5000,DHMH,Funds will support operational costs and programming of the health center for Council District 20.
Salaam,"Apollo Theater Foundation, Inc.",,133630066,10000,DCLA,Funds to support education programs.
Speaker,"Salaam Apollo Theater Foundation, Inc.",Apollo Theater Academy,133630066,50000,DCLA,"To expand the Apollo Theater Academy's career readiness program. Funding provides paid internships, mentorship, and job training in arts administration and technical stage production for BIPOC students in New York City."
Aviles,"Arab American Association of New York, Inc.",Adult Education for MENA & AAPI Communities,113604756,20000,DYCD,Funds will support adult education programs in Council District 38.
Caban,"Arab American Association of New York, Inc.",Emergency Fund,113604756,6000,DYCD,"Funds will be used to support residents of District 22 with mental health support, SNAP benefits, food, clothing and referral services."
Krishnan,"Arab-American Family Support Center, Inc., The",,113167245,7500,DYCD,To fund administrative costs associated with anti-violence programming and services.
