category,initiative,award_type,member,organization,program,ein,amount,agency,purpose
ANTI-POVERTY,,member_item,Aviles,Academy of Medical and Public Health Services,Food Care,272206293,10000,DYCD,Funds will be used to provide support for the Food Care program.
ANTI-POVERTY,,member_item,Joseph,"Access Justice Brooklyn, Inc.",Legal Assistance - Council District 40,113155182,5000,DSS/HRA,Funding will support lawyer costs to assist constituents of Council District 40 in need.
ANTI-POVERTY,,member_item,Osse,"Age Friendly Central Brooklyn, Inc.",,853870243,5000,DFTA,"Funding for senior events and programming in Council District 36 that include but are not limited to the annual Senior Pampering Day, Mothers' Day and Fathers' Day events, and cultural institutions trips."
ANTI-POVERTY,,member_item,Adams,"Allen Community Senior Citizens Center, Inc.",Allen Rockaway Blvd Senior Center,112326244,5000,DFTA,"Funding is to support virtual and recreational programming, and food services at the senior center."
ANTI-POVERTY,,member_item,Brannan,"Alliance for Coney Island, Inc.",Community Giveaways - Council District 47,460802042,5000,DYCD,"Funds will support community giveaway events including back to school supplies, holiday season food and toys."
ANTI-POVERTY,,member_item,Ariola,Alphapointe,,440552486,12500,DYCD,"Funding to support operational expenses associated with assessment, skills development training and programming for the visually impaired and blind."
ANTI-POVERTY,,member_item,Paladino,American-Italian Cancer Foundation,Breast Cancer Outreach & Patient Navigation Program,133035711,10000,DHMH,"Funds will support Breast Cancer Outreach, Education, and Navigation Program which brings medically under-served NYC women into screening each year."
ANTI-POVERTY,,member_item,Sanchez,"Angellyh Yambo Foundation, Inc.",Community Empowerment - Council District 14,882634587,5000,DYCD,Funds to support community mapping workshops for students in Council District 14.
ANTI-POVERTY,,member_item,Joseph,"Arab American Association of New York, Inc.",Mental Health Services - Council District 40,113604756,5000,DYCD,"Funds will be used to support affordable, accessible mental health services."
ANTI-POVERTY,,member_item,Farias,"Ariva, Inc.",Council District 18,320028598,5000,DYCD,Funding to support free income tax preparation assistance in Council District 18.
ANTI-POVERTY,,member_item,Gennaro,"Asian Americans For Equality, Inc.",Chamber On The Go,133187792,15000,SBS,Funding to support the Small Business Development program to provide business assistance and development services focusing on emerging communities with high concentrations of minorities and immigrants.
ANTI-POVERTY,,member_item,Ayala,"Asian Americans For Equality, Inc.",Food Pantry,133187792,10000,DYCD,To support the food pantry in East Harlem.
ANTI-POVERTY,,member_item,Farias,"Asian Americans For Equality, Inc.",Small Business Services - Council District 18,133187792,10000,SBS,Funding to support small business services in Council District 18.
ANTI-POVERTY,,member_item,Brannan,"Asiyah Women's Center, Inc.",Social Services - Council District 47,832104070,10000,DYCD,"To support social work, case management, and other holistic supportive services for people in need in Council District 47, including survivors of domestic violence from under-resourced communities."
ANTI-POVERTY,,member_item,Stevens,Astor Services for Children & Families,Council District 16,141397918,8000,DHMH,"Funds will be used to support programming, community engagement, and outreach in Council District 16."
ANTI-POVERTY,,member_item,Riley,Astor Services for Children & Families,Wellness Services - Council District 12,141397918,15000,DHMH,Funds to be used to provide basic need items to families in Council District 12.
ANTI-POVERTY,,member_item,Powers,"Auschwitz Jewish Center Foundation, Inc.",,133857441,5000,DYCD,Funding will support Holocaust-related education and programming for Council District 4.
ANTI-POVERTY,,member_item,Salaam,"Bailey House, Inc.",,133165181,5000,DHMH,"To support family cohesion and stability by funding year-round recreational, social, and youth-oriented activities for single-parent families affected by HIV/AIDS."
ANTI-POVERTY,,member_item,Ayala,"Bailey House, Inc.",Family Support Program - Schafer Hall,133165181,5000,DHMH,To support on and off-site services and recreational activities for the Family Support Program at Schafer Hall.
ANTI-POVERTY,,member_item,Brooks-Powers,"Battalion Pentecostal Assembly, Inc.",Council District 31,364391337,10000,DYCD,Funds are to support programming and services in Council District 31.
ANTI-POVERTY,,member_item,Zhuang,"Be Proud, Inc.",,582674169,10000,DYCD,Funding for holiday celebrations open to the community in Council District 43.
ANTI-POVERTY,,member_item,Feliz,"Be Wise N.Y.C., Inc.",Youth Services - Council District 15,884300485,10000,DYCD,Funding will support youth services and educational programming in District 15.
ANTI-POVERTY,,member_item,Narcisse,Bergen Basin Community Development Corporation d/b/a Millennium Development,Youth Sports Clinic - Council District 46,113199040,10000,DYCD,Funding to support the provision of sports clinics for youth in Council District 46.
ANTI-POVERTY,,member_item,Stevens,"Bible Church of Christ, Inc., The",Community Programming - Council District 16,136186140,10000,DYCD,"Funds will be used to support the ongoing distribution of food, goods and other social services in Council District 16."
ANTI-POVERTY,,member_item,Feliz,Big Initiatives Incorporated,Council District 15,465083170,5000,DYCD,Funding will go towards supporting collaborative initiatives with the Decatur Block Association and tree stewardship programming in Council District 15.
ANTI-POVERTY,,member_item,Brannan,"Black Veterans for Social Justice, Inc.",Social Services for Homeless & At-Risk Veterans,112608983,5000,DYCD,"To support outreach, case management, housing assistance, and homelessness prevention services for homeless and at-risk veterans and community members in Brooklyn."
ANTI-POVERTY,,member_item,Salaam,"Blacklining Foundation, Inc.",Educational Programs,861557595,5000,SBS,"Funds will support educational programs on sustainability empowering financial literacy, and personal development for marginalized communities, covering staff, materials and engagement."
ANTI-POVERTY,,member_item,Marte,"Blue Card, Inc., The",Holocaust Survivor Assistance Program,131623910,5000,DFTA,"To support assistance programs, which helps Holocaust survivors in need access resources to meet their basic human needs, including food, rent, utilities, medicine, and socialization."
ANTI-POVERTY,,member_item,De La Rosa,"Blue Card, Inc., The",Holocaust Survivor Assistance Program - Council District 10,131623910,10000,DFTA,To support Blue Card Programming in Council District 10.
ANTI-POVERTY,,member_item,Louis,"B'nai B'rith Hillel Foundation, Inc.",Council District 45,116036253,5000,DYCD,After School Program for the kids from the Homeless Shelter and Thanksgiving for Homeless New Yorkers in Council District 45.
ANTI-POVERTY,,member_item,Hudson,"BRIC Arts Media Brooklyn, Inc.",Community Adult & Youth Media Program - Council District 35,112547268,20000,DCLA,Funding to support Adult and Youth Media Program at BRIC.
ANTI-POVERTY,,member_item,De La Rosa,"Broadway Housing Communities, Inc.",,133212867,5000,DYCD,To support the BHC Dorothy Day Early Childhood Center in Council District 10.
ANTI-POVERTY,,member_item,Stevens,"Bronx Community Foundation, Inc., The",Nonprofit Engagement - Council District 16,814237999,10000,DYCD,Funds will be used to support Nonprofit Roundtables and other capacity building programming in Council District 16.
ANTI-POVERTY,,member_item,Riley,"Bronx Parent Housing Network, Inc.",Council District 12,134100758,10000,DYCD,Funds to be used for housing support in City Council District 12.
ANTI-POVERTY,,member_item,Stevens,BronxCare Health System,Viral Hepatitis Initiative - Council District 16,131974191,5000,DHMH,Funds to support BronxCare's Viral Hepatitis Initiative program for residents in Council District 16.
ANTI-POVERTY,,member_item,Ayala,"BronxWorks, Inc.",Healthy & Livable Mott Haven Program,133254484,10000,DHMH,To provide funding for programs related to fostering food security in the Mott Haven neighborhood.
ANTI-POVERTY,,member_item,Osse,"Brooklyn Arts Council, Inc.",,237072915,13250,DCLA,Funding to support cultural programming in Council District 36.
ANTI-POVERTY,,member_item,Brooklyn,"Book Bodega, Inc.",Book Distribution Events - Council District 36,833811732,5000,DYCD,Funding to provide free book distribution events for Council District 36.
ANTI-POVERTY,,member_item,Brooklyn,Defender Services,Legal & Social Work Services - Council District 33,113305406,5000,DSS/HRA,To provide legal and social work services for residents in Council District 33.
ANTI-POVERTY,,member_item,Williams,Brooklyn Legal Services Corporation A,,132605599,30000,DSS/HRA,"Funding will provide senior homeowners facing foreclosure with representation, advice, and appropriate referrals."
ANTI-POVERTY,,member_item,Brooklyn,"Legal Services, Inc.",Free Legal Services - Council District 37,132605605,10000,DSS/HRA,"Funds will support free legal services in Council District 37 for issues including foreclosure prevention, immigration, tenants rights, elder law, and domestic violence."
ANTI-POVERTY,,member_item,Brooklyn,Museum,School Education Programs - Council District 35,111672743,10000,DCLA,"Funding to support arts and social justice curricula and tours for Council District 35 schools, including Benjamin Banneker Academy for Community Development, BASE, Clara Barton, 241K, 316K, 46K, 532K, 56K and Urban Assembly Unison School."
ANTI-POVERTY,,member_item,Brooklyn,"Perinatal Network, Inc.",Maternal and Child Health Services,133428222,5000,DHMH,"Funding will provide services for the maternal child health population, which will include outreach and engagement to identify program eligible participants"
ANTI-POVERTY,,member_item,Brannan,Brooklyn Public Library,Coney Island Library Programs,111904261,5000,BPL,To support cultural and educational programming at Coney Island Library.
ANTI-POVERTY,,member_item,Brooklyn,"Sunset Park Lions Club, Corp",Community Services & Programs,472994664,7500,DYCD,"Funds to support diabetes, hunger, vision, environment and childhood cancer programs."
ANTI-POVERTY,,member_item,Narcisse,"CAMBA, Inc.",Youth Programming - South Shore Educational Complex,112480339,15000,DYCD,Funding to provide youth programming and recreational activities at South Shore Educational Complex.
ANTI-POVERTY,,member_item,Louis,"Caribbean Women's Health Association, Inc.",Council District 45,133323168,5000,DHMH,"Funds will provide high quality, comprehensive, culturally appropriate health, immigration and social support services in Council District 45."
ANTI-POVERTY,,member_item,Abreu,"Cathedral Church of St. John the Divine, The",Food Pantry - Council District 7,131623934,5250,DYCD,Funding to support the Cathedral food pantry and associated programming.
ANTI-POVERTY,,member_item,Abreu,"Catholic Charities Community Services, Archdiocese of New York",Alianza Sports Tournaments - Council District 7,135562185,5000,DYCD,Funding to support Alianza Sports Tournaments at La Plaza Beacon.
ANTI-POVERTY,,member_item,Ayala,"Catholic Charities Community Services, Archdiocese of New York",St. Cecilia's Food Pantry,135562185,15000,DYCD,To provide funding for St. Cecilia's Food Pantry in East Harlem.
ANTI-POVERTY,,member_item,Abreu,"Catholic Charities Community Services, Archdiocese of New York",Washington Heights Food Pantry & Homebound - Council District 7,135562185,5750,DYCD,Funding to support the Washington Heights Food Pantry and associated costs.
ANTI-POVERTY,,member_item,Holden,"Catholic Charities Neighborhood Services, Inc.",Food Support - Council District 30,112047151,5000,DFTA,Funds will be used to support food purchasing for pantries in Council District 30.
ANTI-POVERTY,,member_item,Restler,Center for Alternative Sentencing and Employment Services,Council District 33,132668080,5000,DYCD,To support programs that divert young adults from incarceration in Council District 33.
ANTI-POVERTY,,member_item,Restler,"Center for Community Alternatives, Inc.",Council District 33,161395992,5000,DYCD,Funds to support the MAT clinic in Council District 33.
ANTI-POVERTY,,member_item,Brooks-Powers,Center for Family Representation,Council District 31,510419496,5000,DYCD,"Funding will support a number of services including case management, referrals, counseling, workshops and additional legal services in Council District 31."
ANTI-POVERTY,,member_item,Nurse,"Center for NYC Neighborhoods, Inc.",Homeowner Support - Council District 37,830506416,5000,HPD,"Funds will support homeowner assistance and engagement, including but not limited to the Homeowner Help Desk, mortgage and deed fraud assistance, and foreclosure prevention in Council District 37."
ANTI-POVERTY,,member_item,Restler,Central American Legal Assistance,Immigrant Legal Services - Council District 33,112859151,8000,DSS/HRA,To support removal defense for detained immigrants and for asylum seekers in Council District 33.
ANTI-POVERTY,,member_item,Caban,"Central Astoria Local Development Coalition, Inc.",Tenant Assistance - Council District 22,112652331,22000,DCLA,"Funds will be used for bilingual Tenant Counseling, Workshops and Assistance to Council District 22."
ANTI-POVERTY,,member_item,Krishnan,"Chamber of Commerce Borough of Queens, Inc.",Council District 25,110559220,6000,SBS,Funds will be used to support outreach to businesses and individuals located in Council District 25.
ANTI-POVERTY,,member_item,Krishnan,"Chess-in-the-Schools, Inc.",,136119036,5000,DOE,"Funds will be used to cover staff salaries, benefits, and supplies for Chess-in-schools programs."
ANTI-POVERTY,,member_item,Sanchez,"Children's Arts & Science Workshops, Inc.",Public School 310X Marble Hill (10X310) - After School Community Learning Center,132752494,30000,DYCD,To support additional free afterschool programming seats at the After School Learning Center at PS 310X Marble Hill.
ANTI-POVERTY,,member_item,Marte,"Chinatown Manpower Project, Inc.",Workforce & Entrepreneurship Programming & Services,132755214,5000,DYCD,"Funding will be utilized to provide workforce and/or entrepreneurship in the form of training, technical assistance, webinars, and one-on-one counseling."
ANTI-POVERTY,,member_item,Menin,"Chinese American Planning Council, Inc.",Council District 5,136202692,5000,DYCD,Funding will be used to enhance the multilingual social services program aimed at reducing poverty and providing support and access to services for immigrants and limited English proficiency community members in City Council District 5.
ANTI-POVERTY,,member_item,Aviles,"Chinese American Planning Council, Inc.",Digital Literacy & Inclusion Initiative,136202692,10000,DYCD,Funding will support programming to support community members build their digital literacy.
ANTI-POVERTY,,member_item,Ung,"Chinese American Planning Council, Inc.",Queens SCSEP (Senior Employment),136202692,5000,DYCD,"Funding will support programming to provide employment assistance/services to seniors age 55 and over, including funding staff support, program supplies, and costs associated with overhead/operations."
ANTI-POVERTY,,member_item,Bottcher,Church of the Holy Apostles,Meal Programs - Council District 3,132892297,20000,DYCD,Funds will be used to support meal programs.
ANTI-POVERTY,,member_item,Restler,"Churches United for Fair Housing, Inc.",Council District 33,264698161,10000,DYCD,To support affordable housing outreach in Council District 33.
ANTI-POVERTY,,member_item,Joseph,"Churches United for Fair Housing, Inc.",Affordable Housing Assistance - Council District 40,264698161,10000,HPD,"Funding will be used to offer year-round remote and in-person Affordable Housing Assistance works to community members, training, and guidance to navigate New York City's affordable housing lottery application process."
ANTI-POVERTY,,member_item,Gutierrez,"Churches United for Fair Housing, Inc.",Youth Organizing - Council District 34,264698161,65000,DYCD,Funding will support youth organizing in Council District 34.
ANTI-POVERTY,,member_item,Krishnan,"Citizens Committee for New York City, Inc.",,510171818,5000,DYCD,Funding will cover Citizens general operating costs to increase the number of grassroots projects and aspiring community leaders.
ANTI-POVERTY,,member_item,Ung,"Citizens Committee for New York City, Inc.",All In Neighborhood Grants & Neighborhood Business Grants,510171818,10000,DYCD,"To support the operational expenses of the Neighborhood Grants program in Council District 20, which offers capacity building workshops, project planning expertise to volunteer-led groups."
ANTI-POVERTY,,member_item,Osse,"City Harvest, Inc.",,133170676,5000,DYCD,Funding for food distribution in Council District 36.
ANTI-POVERTY,,member_item,Hudson,"City Harvest, Inc.",Healthy Neighborhoods - Council District 35,133170676,5000,DYCD,Funding to support food distribution programs at NYCHA developments and the Healthy Neighborhoods Initiative.
ANTI-POVERTY,,member_item,Caban,City University of New York,CUNY School of Law Justice & Auxiliary Services Corporation - CLRN Programming - Council District 22,133893536,5000,CUNY,Funds will support CLRN programming in Council District 22.
ANTI-POVERTY,,member_item,Louis,City University of New York,CUNY School of Law Justice & Auxiliary Services Corporation - Council District 45,133893536,11000,CUNY,"Funds to support Council District 45 with legal services for migrants, asylum seekers and Refugee and Immigration legal clinics, as well as meet with constituents to provide consultation on legal matters and translation services."
ANTI-POVERTY,,member_item,Sanchez,City University of New York,CUNY School of Law Legal Services - Council District 14,133893536,25000,CUNY,Funds will support legal services for Council District 14 residents at CUNY School of Law.
ANTI-POVERTY,,member_item,Farias,CityMeals on Wheels,Council District 18,133634381,20000,DYCD,Funding to support emergency food packages in Council District 18.
ANTI-POVERTY,,member_item,Salamanca,"Coalition for the Homeless, Inc.",Food Pantry Van - Council District 17,133072967,10000,DHS,Funding to support the food pantry van for the homeless in Council District 17.
ANTI-POVERTY,,member_item,Marte,"Coalition for the Homeless, Inc.",Grand Central Food Program - Council District 1,133072967,5000,DYCD,To support the Grand Central Food Program and its services within Council District 1.
ANTI-POVERTY,,member_item,Stevens,"Coalition for the Homeless, Inc.",Grand Central Food Program - Council District 16,133072967,10000,DYCD,Funds will be used to support Grand Central Food Program in Council District 16.
ANTI-POVERTY,,member_item,Stevens,"Coalition on Positive Health Empowerment, Inc.",Healthy Savvy - Council District 16,272654975,7000,DHMH,"Funds to support Hep C Testing, HIV Awareness, Health Screening, Linkage to Care and Events in Council District 16."
ANTI-POVERTY,,member_item,Nurse,"Communities Resist, Inc.",Tenant Organizing & Anti- Displacement Free Legal Services - Council District 37,841899350,15000,DSS/HRA,"Funds will support tenant advocacy and housing rights in Council District 37 including multilingual tenant outreach, comprehensive legal services, and fair housing education."
ANTI-POVERTY,,member_item,Restler,"Community Help in Park Slope, Inc.",Soup Kitchen & Food Pantry,112449994,7000,DYCD,Funding to support Soup Kitchen and Food Pantry operations.
ANTI-POVERTY,,member_item,Hanif,"Community Help in Park Slope, Inc.",Soup Kitchen & Food Pantry,112449994,13000,DYCD,Funding to support operating expenses of CHiPS Soup Kitchen and Food Pantry.
ANTI-POVERTY,,member_item,Marmorato,"Community Renew Org, Inc.",,994618279,10000,DYCD,"Funds will be used for cleaning public spaces, graffiti removal, and other aid to impoverished areas in the Bronx."
ANTI-POVERTY,,member_item,Brooks-Powers,"Community Voices Heard, Inc.",NYCHA Residents - Council District 31,133901997,5000,DYCD,"Funding to support CVH's engagement and outreach programs in Council District 31, specifically with NYCHA residents."
ANTI-POVERTY,,member_item,Vernikov,Cong Chasdei Lev,,454786470,10000,DYCD,Funding to support the costs associated with obtaining food and supplies for distribution to the needy.
ANTI-POVERTY,,member_item,Louis,"Council of Jewish Organizations of Flatbush, Inc.",Council District 45,112864728,9000,DYCD,"The program offers clients default resolution, loss mitigation, eviction and foreclosure prevention, assistance in rent arrears, and protecting credit."
ANTI-POVERTY,,member_item,Hanif,"Council on the Environment, Inc.",NYCHA Community Supported Agriculture (CSA) Project,132765465,25000,DYCD,Funds will be used for NYCHA Community Supported Agriculture (CSA) Project in collaboration with Gowanus Mutual Aid.
ANTI-POVERTY,,member_item,Paladino,"Dance Parade, Inc.",Ageless Action Dance Residencies,208576378,5000,DCLA,Funds will support the Ageless Action Dance Residency Program in Council District 19.
ANTI-POVERTY,,member_item,Moya,Department of Education,Corona Arts & Sciences Academy (24Q311),136400434,10000,DOE,To support programming at Corona Arts & Sciences Academy (24Q311).
ANTI-POVERTY,,member_item,Moya,Department of Education,Intermediate School 061Q Leonardo Da Vinci (24Q061),136400434,10000,DOE,To support programming at Intermediate School 061Q Leonardo Da Vinci (24Q061).
ANTI-POVERTY,,member_item,Sanchez,Department of Education,Intermediate School 232X (09X232),136400434,5000,DOE,Funds will be used for Intermediate School 232X (09X232) supplemental education such as afterschool programming or transportation to off site educational activities.
ANTI-POVERTY,,member_item,Sanchez,Department of Education,Middle School 390X (10X390) - Leadership Retreat,136400434,5000,DOE,Funds to host and support a leadership retreat at Middle School 390 (10X390).
ANTI-POVERTY,,member_item,Moya,Department of Education,Public School 014Q Fairview (24Q014),136400434,10000,DOE,To support programming at Public School 014Q Fairview (24Q014).
ANTI-POVERTY,,member_item,Feliz,Department of Health and Mental Hygiene,Health Bucks - Council District 15,136400434,50000,DHMH,Funds will go towards the purchase of Health Bucks for constituents of District 15.
ANTI-POVERTY,,member_item,Sanchez,Department of Health and Mental Hygiene,Health Bucks Program - Council District 14,136400434,10000,DHMH,Funds will support Health Bucks Program in Council District 14.
ANTI-POVERTY,,member_item,Osse,Department of Parks and Recreation,Citibins - Herbert Von King Park & Brower Park,136400434,9750,DPR,Funding for Citibins at Herbert Von King Park and Brower Park.
ANTI-POVERTY,,member_item,Adams,Department of Youth and Community Development,,136400434,5000,DYCD,Funds will support community outreach efforts in civic and social needs.
ANTI-POVERTY,,member_item,Salaam,"Doe Fund, Inc., The","Ready, Willing & Able Program",133412540,9500,DHS,"Funding will support the Ready, Willing & Able program to provide paid transitional work, education, and job training for homeless individuals, helping them break the cycle of poverty and achieve long-term economic stability."
ANTI-POVERTY,,member_item,Abreu,"Dominican Community Center NYC, Inc.",ESL & Computer Training - Council District 7,134188781,5000,DYCD,Funding to support ESL and Computer Training in Council District 7.
ANTI-POVERTY,,member_item,Hanks,"Dr. Theodore A. Atlas Foundation, Inc.",Food Distribution - Council District 49,134012789,30000,DYCD,Funding will support food distribution and turkey giveaways services in Council District 49.
ANTI-POVERTY,,member_item,Ung,"East River Development Alliance, Inc.",Council District 20,861096987,5000,SBS,Funding to support Urban Upbound's Free Tax Preparation and benefit services in Council District 20.
ANTI-POVERTY,,member_item,Nurse,"East River Development Alliance, Inc.",Financial Services - Council District 37,861096987,5000,DYCD,Funds will support financial programs for Council District 37.
ANTI-POVERTY,,member_item,Gennaro,"East River Development Alliance, Inc.",Pomonok Financial Support Seminars / Tax Prep,861096987,10000,DYCD,Funding will support a range of services surrounding UUs free tax preparation program at Pomonok Housing in District 24.
ANTI-POVERTY,,member_item,Feliz,"East River Development Alliance, Inc.",Tax Preparation Services - Council District 15,861096987,15000,DYCD,Funds will go towards providing tax preparation services.
ANTI-POVERTY,,member_item,Moya,"Ecuadorian Civic Committee of New York City, Inc.",Ecuadorian Heritage Month Celebration & Parade - Council District 21,113553172,10000,DYCD,Funds will be used to support Ecuadorian Heritage Month celebration and Parade in Council District 21.
ANTI-POVERTY,,member_item,Brannan,"Edith and Carl Marks Jewish Community House of Bensonhurst, Inc.",Adult Literacy & ESOL-Civics Education - Council District 47,111633484,5000,DYCD,"To support educational programs on literacy, ESOL, and civics available to vulnerable immigrant adult residents of Council District 47."
ANTI-POVERTY,,member_item,Joseph,"Erasmus Neighborhood Federation, Inc.",Housing Assistance - Council District 40,112490986,5000,HPD,Funding to support programming and services associated with Housing Assistance in Council District 40.
ANTI-POVERTY,,member_item,Joseph,Ezras Cholim Yad Ephraim,Council District 40,542196301,5000,DYCD,"Funding to support food distribution, blood drive events and medical equipment loan programs."
