member,organization,program,ein,amount,agency,purpose
Krishnan,New Yorkers for Parks,Daffodil Project - Council District 25,136167879,10000,DYCD,"Funding to support distribution and planting of 18,000 daffodil bulbs in Council District 25 as part of the Daffodil Project."
Holden,"Newtown (Italian) Senior Citizens Center, Inc.",Council District 30,112308129,55000,DFTA,"Funding to support a Translator/Caseworker Assistant who speaks Cantonese and Mandarin, serving seniors in Council District 30."
Gutierrez,"Newtown Creek Alliance, Inc.",Environmental Education & Community Stewardship - Council District 34,261832918,5000,DYCD,Funding will support Environmental Education and Community Stewardship in Council District 34.
Louis,"Nexgen Women In Accounting, Inc.",Future Financial Leaders - Council District 45,851202832,5000,DYCD,Funding to support programs designed to introduce students aged 12 to 18 to the world of accounting and finance in Council District 45.
Hanif,"NIA Community Services Network, Inc.",Backpack Giveaway - Kensington,112697931,5000,DYCD,Support the purchase of backpacks and other operational costs to host a backpack giveaway located at Public School 179K Kensington (20K179) for the Kensington community.
Brannan,"NIA Community Services Network, Inc.",Community Programming & Events - Council District 47,112697931,22500,DYCD,To Support community programming in Council District 47.
Mealy,"NIA Community Services Network, Inc.",Council District 41,112697931,10000,DCLA,Funds will support community programming in Council District 41.
Speaker,"Aviles NIA Community Services Network, Inc.",Senior Recreation,112697931,25000,DFTA,"To provide funding support for senior recreation, assistance, and support services."
De La Rosa,Nido de Esperanza Charitable Society,,825510616,5000,DYCD,To support programs for low income expecting mothers.
Feliz,"Nino de la Caridad, Inc.",Youth Programming - Council District 15,810834466,30000,DYCD,Funds will go towards providing wholistic health and wellness programming to youth in Council District 15.
Carr,"Noble Maritime Collection, The",,133351673,20000,DCLA,Funds to be used for after-school programming.
Morano,"Noble Maritime Collection, The",Special Musical Education Programming - I.S. 007R Elias Bernstein (31R007) District 75 Programs,133351673,5000,DCLA,Funding to support Special Musical Education programming for D75 schools at IS 7R (31R007).
Brooks-Powers,Non-Traditional Employment for Women,Council District 31,133272001,5000,DYCD,Funding to support workforce development services in Council District 31.
Abreu,Northern Manhattan Arts Alliance,Annual Uptown Arts Programming - Council District 7,261997496,5000,DCLA,Funding to support Annual Uptown Arts Stroll/Paseo de las Artes. Page 115 Appendix B: Local Initiatives Council Member Sponsor Legal Name of Organization - Program Name Tax ID Amount Agency Purpose of Funds
De La Rosa,Northern Manhattan Arts Alliance,Council District 10,261997496,10000,DCLA,To support the Uptown Arts Stroll and NOMAA's programming and events in Council District 10.
Salaam,Northern Manhattan Coalition for Immigrant Rights,,133255591,5000,DSS/HRA,"To provide free legal services to low-income immigrant families, supporting family reunification, naturalization, DACA renewals, asylum applications, and legal protections for survivors of domestic violence, ensuring stability and economic mobility."
Abreu,Northern Manhattan Coalition for Immigrant Rights,Adult Literacy Education - Council District 7,133255591,5000,DYCD,Funding to support The Coalition’s Adult Literacy Education programming.
Sanchez,"Northwest Bronx Community and Clergy Coalition, Inc.",Combatting Displacement - Council District 14,132806160,15000,HPD,"To support tenant assistance organizing through know your rights trainings and organizing local merchants, ensuring they have access to business services, legal support and additional assistance."
Zhuang,Norwegian Christian Home and Health Center,Community Medical Services,111633518,5000,DYCD,Funding to support costs associated with providing short term rehabilitation programming and services in Council District 43.
Banks,"Notes in Motion, Inc.",Public School 66K (18K066) & East New York Family Academy (19K409) - Dance Education Program,320005633,5000,DCLA,Funds will be used for Dance education programming at Public School 66K (18K066) and East New York Family Academy (19K409) in Council District 42.
Banks,"Nourishing Wells, Inc.",Hope Day Program - Council District 42,994498650,10000,DYCD,"Funds to support the Hope Day which provides a day filled with Hope, through leveraging various services, activities, lunch, and distribution of resources to attendees in Council District 42."
Schulman,"NYC Family Serenity, Inc.",Mother's Day Music Festival - Council District 29,452938143,5000,DYCD,"To support the annual ""Mother's Day Music Festival Health Fair"" that brings together different ethnic groups and families to promote peace and cultural understanding in Council District 29."
Speaker,"Brewer NYC First, Inc.",City-Wide Youth Robotics Leagues and STEM Programs,462754933,100000,DYCD,"Funding will provide STEM education programs and youth robotics leagues for young people in New York City. Funding would support staffing, materials and services necessary to host programs."
Marte,NYC Kids Project,Council District 1,472103754,5000,DCLA,Funding will support programming in Council District 1.
Salaam,NYC Kidsfest,,263538262,5000,DCLA,"To empower and inspire young people through a multi-day performing arts festival and educational workshops, fostering creativity, confidence, and community engagement."
Brannan,"NYC Teens for Animals, Inc.",Animal Rescue & Care - Council District 47,822535966,5000,DHMH,"Funds will support rescue and care services for feral and stray animals, including feral cats, in Council District 47."
Marte,"NYLaughs, Inc.",Council District 1 & Manhattan,262348306,5000,DCLA,Funding will support stand-up comedy performances throughout Council District 1 and Manhattan.
Brewer,"NYLaughs, Inc.",Free Stand-Up Comedy,262348306,5000,DCLA,Funds will support free stand-up comedy shows in Council District 6.
Powers,"NYLaughs, Inc.",The Laughter Series - Council District 4,262348306,5000,DCLA,Funding will support free stand-up comedy shows at parks and other locations in Council District 4.
Speaker,"Marmorato NYSARC, Inc., New York City Chapter",,135596746,50000,DHMH,Funds will support programming for the developmentally disabled in Council District 13.
Brooks-Powers,Ocean Bay Community Development Corporation,BRIDGE Family Enrichment - Council District 31,841622031,5000,DYCD,Funding to support “BRIDGE Family Enrichment” programming in Council District 31.
Vernikov,"Ohel Children's Home and Family Services, Inc.",,116078704,10000,DFTA,Funding to support a variety of district based senior services.
Felder,"Ohel Children's Home and Family Services, Inc.",Mental Health & Trauma Services,116078704,5000,DHMH,"To provide services to people with mental illness including education, housing, case management, crisis intervention, counseling, and training for independent living."
Lee,"Ohel Children's Home and Family Services, Inc.",Mental Health Services - Council District 23,116078704,10000,DHMH,Funding will support mental health services in Council District 23. Page 116 Appendix B: Local Initiatives Council Member Sponsor Legal Name of Organization - Program Name Tax ID Amount Agency Purpose of Funds
Caban,"Old Astoria Neighborhood Association, Inc.",Community Support,471688610,9000,DYCD,Funds will be used to defray operating expenses associated with presenting monthly community meetings.
Hanif,Old Stone House of Brooklyn,,113032836,12000,DCLA,To support public hours and programming at Old Stone House as well as the outdoor meeting and performance spaces in Washington Park and 4th Street.
Riley,Olinville Old Timers Association,Olinville Old Timers Day - Council District 12,830761818,10000,DYCD,Funds to be utilized to support Olinville Old Timers Day and all community engagement activities in Council District 12.
Feliz,"On Point NYC, Inc.",Syringe Litter Removal,208672015,10000,DHMH,Funding will go towards supporting syringe litter mitigation efforts in Council District 15.
Morano,"On Your Mark, Inc.",Art Program,133128315,14500,DHMH,Funding will be used to support On Your Mark's Art programming.
Morano,"On Your Mark, Inc.",Mental Health & Wellness Program,133128315,6000,DHMH,Funds will support mental health and wellness program for respite and day hab individuals.
Morano,"On Your Mark, Inc.",Project Teamwork,133128315,10000,DHMH,Funding to support Project Teamwork program.
Morano,"On Your Mark, Inc.",Special Athletics,133128315,10000,DHMH,Funding to support special athletics programming and services.
Hanks,"On Your Mark, Inc.",Special Athletics Program,133128315,5000,DHMH,Funding will support a special athletics program.
Salaam,One Hundred Black Men,,237379940,5000,DYCD,"Funding will support sports mentorship, & leadership for low-income youth in Harlem, along with community events and basketball competitions."
Gutierrez,"Open Space Alliance for North Brooklyn, Inc.",Community Board 1 - Parks & Open Spaces,010849087,5000,DPR,Funding will support direct services (maintenance and horticulture) and public programs in Community Board 1 parks and open spaces.
Powers,"Open Squash, Inc.",,455149499,5000,DYCD,"Funding will support Open Squash's afterschool squash program, which provides free access to the sport for low-income families."
Rivera,"Open Squash, Inc.",,455149499,10000,DYCD,Funds will support Open Squash's programs and operations.
Menin,"Open Squash, Inc.",Council District 5,455149499,1000,DYCD,Funds would be intended for Council District 5 and programming that serves youths.
Vernikov,Operation Warrior Shield,,811268470,5000,DHMH,"Funding to support comprehensive support services, and mental health services for veterans."
Zhuang,Operation Warrior Shield,,811268470,5000,DHMH,Funding to support the provision of Operation Warrior Shield (OWS) mental health programs in Council District 43.
Paladino,"Oratorio Society of Queens, Inc.",Community Concerts & Events - Council District 19,112781564,5000,DCLA,Funding supports operating costs of producing and providing community concerts and events in Council District 19.
Dinowitz,"Orchestra of The Bronx, Inc., The",A Bronx MESSIAH - Council District 11,133940188,10000,DYCD,Funding to support production of A Bronx MESSIAH in Council District 11.
Restler,"Original Music Workshop, Inc.",Council District 33,272974840,5000,DCLA,To support educational programming for K-12 students in Council District 33.
Marmorato,"Orthodox Christian Harbour, Inc.",,333510156,5000,DYCD,Funds will be used to support cultural organizations to provide programming focused on the cultural history or traditions of an immigrant community in New York City.
Ayala,Our Firefighters Children's Foundation,East Harlem Repertory Theater,542064625,10000,DCLA,To provide high quality and affordable live theater that will enrich the inner city community of color with programs that are entertaining and educational.
Hudson,"Outside with Recess Village, Inc.",Elder Explorers - Council District 35,934336248,8000,DFTA,Funding to support outdoor activities for older adults in Council District 35.
Williams,"Outstanding Renewal Enterprises, Inc.",Council District 27,133320984,6000,DSNY,Funding will support e-waste reuse and collection events held in Council District 27.
Ung,"Outstanding Renewal Enterprises, Inc.",E-Waste Collection - Council District 20,133320984,5000,DSNY,To support electronic waste collection events in Council District 20.
Brewer,"Outstanding Renewal Enterprises, Inc.",E-Waste Collection Events,133320984,5000,DSNY,"Funds will support E-Waste Collection Events, Education, and Composting programming and services. Page 117 Appendix B: Local Initiatives Council Member Sponsor Legal Name of Organization - Program Name Tax ID Amount Agency Purpose of Funds"
Gennaro,"Outstanding Renewal Enterprises, Inc.",E-Waste Events - Council District 24,133320984,10000,DSNY,Funding to support Electronic waste recycling events in Council District 24 (print outreach materials and staff time spent coordinating events).
Rivera,"Outstanding Renewal Enterprises, Inc.",Lower East Side Ecology Center,133320984,5000,DSNY,Funds will support Lower East Side Ecology Center's programs and operations.
Joseph,Pakistani American Skilled Women Organization,Domestic Violence Assistance - Council District 40,850869897,5000,DYCD,Funds will be used to support Domestic Violence assistance to immigrant women.
Salaam,"Palante Harlem, Inc.",,800209989,5000,DYCD,"To provide comprehensive eviction prevention, housing stability services, and legal support to low-income families, helping them avoid displacement and achieve long- term housing security."
Sanchez,"Palante Harlem, Inc.",Homelessness Prevention & Housing Preservation,800209989,10000,HPD,To support homeless prevention programming for Council District 14 residents.
Brewer,"Palante Harlem, Inc.",Homelessness Prevention & Housing Services,800209989,6000,HPD,Funds will support homelessness prevention and housing preservation services in Council District 6.
Powers,"Paley Center for Media, The",Education Program,132805582,5000,DCLA,Funding will support the Paley Center for Media’s Education Program.
Marte,"Paper Bag Players, Inc., The",Theater for All,131972960,5000,DCLA,"Funding will support ""The Paper Bag Players NYC Theater for All,"" which provides reduced price to free theater tickets, free public performances and after-school workshops."
Salamanca,"Paralegals FTC, Inc.",South Bronx Paralegal Services,932043780,35000,DSS/HRA,Funding will be used to provide paralegal services in the South Bronx.
Zhuang,Parent Child Relationship Association,,831900689,10000,DYCD,Funds to support the Community Family Support Program which seeks to help immigrants adjust to their new life in the United States.
Aviles,Parent Child Relationship Association,Community Family Support Program,831900689,20000,DYCD,To support community family support program in Council District 38.
Brannan,Parent Child Relationship Association,Volunteer Community Cleanups - Council District 47,831900689,10000,DYCD,"To support expenses associated with planning, organizing, and running volunteer community cleanups in Council District 47."
Aviles,"Park Slope Fifth Avenue District Management Association, Inc.","Supplemental Sanitation, Greening Program & Business Services",263926626,6000,DYCD,"Funds to support supplemental sanitation, greening programming and Business services."
Williams,Partners Uplifting our Daughters and Sons,Council District 27,473679850,16000,DYCD,Funds will be used to support programming in the 27th Council District.
Williams,"Pearls & Ivy Foundation of Queens, Inc.",Council District 27,454427316,10000,DYCD,Funding will support programming in Council District 27.
Marte,"Peculiar Works Project, Inc.",,134089362,5000,DCLA,Funds will be used to support diverse teams of local artists and performers and to help reach new audiences.
Louis,Peniel French Seventh-Day Adventist,Food Pantry - Council District 45,113004906,5000,DYCD,Funding to support food pantry in Council District 45.
Brooks-Powers,Peninsula Preparatory Academy Charter,Council District 31,861106640,10000,DYCD,Funding will support virtual after-school intervention programs to support educational enrichment in Council District 31.
Joseph,"People In Need, Inc.",Council District 40,812473789,7000,DYCD,"Funds will support informational and training workshops for women, including digital literacy and access to resources."
Abreu,"People's Theatre Project, Inc.",Community Programming - Council District 7,264705999,5000,DCLA,Funds to support the People's Theatre Project Programming in Council District 7.
Gennaro,"Per Scholas, Inc.",Council District 24,043252955,10000,DYCD,Funds to provide trainings and other programming that would be used for Council District 24.
Menin,"Per Scholas, Inc.",Council District 5,043252955,5000,DYCD,To provide for training and other programming that would be used for Council District 5. Page 118 Appendix B: Local Initiatives Council Member Sponsor Legal Name of Organization - Program Name Tax ID Amount Agency Purpose of Funds
Stevens,"Per Scholas, Inc.",IT Workforce Training - Council District 16,043252955,5000,DYCD,The Funds will be used for the cost of running IT Workforce Training program for Council District 16 participants which is an intensive full-time IT training that prepares under/unemployed individuals for successful careers as IT professionals.
Hudson,"Per Scholas, Inc.",New York Tech Training Program - Council District 35,043252955,9000,DYCD,Funding to support tech education programming for Council District 35 residents.
Banks,"Per Scholas, Inc.",Tech Training Program - Council District 42,043252955,5000,DYCD,Funds will be used for Tech Training Program in Council District 42.
Brooks-Powers,"Perfect Piece of the Puzzle, Inc.",Council District 31,813810105,5000,DYCD,Funding to support educational programming for people with disabilities within Council District 31.
Restler,"Pesach Tikvah Hope Development, Inc.","Holocaust Services, Clinic Services & Disability Services - Council District 33",112642641,6000,DYCD,To support programming including the After School Respite Program for children with disabilities in Council District 33.
Brewer,"Philharmonic-Symphony Society of New York, Inc.",Music Education - Jessie Isador Straus School (03M199),131664054,5000,DCLA,Funds will support Music Education at PS 199 (03M199).
Stevens,"Phipps Neighborhoods, Inc.",Council District 16,132707665,10000,DYCD,"Funding to support the costs associated with special events/activities at Crotona Park including Concerts, Movies in the Park, Family Day Celebration, Seasonal Events, and Walking and Running activities for the community of Council District 16."
Farias,"Phipps Neighborhoods, Inc.",Council District 18,132707665,45000,DYCD,Funding to support the STEAM Clubs at the Soundview and Sotomayor Cornerstones.
Ayala,"Phipps Neighborhoods, Inc.",Equitable Food Access,132707665,5000,DYCD,Funds to provide support for food pantry and other health and wellness activities.
Stevens,"Phipps Neighborhoods, Inc.","Precinct Councils (42nd, 44th Precincts) & PSA 7 - Council District 16",132707665,5629,DYCD,"Funds will be used towards the costs of running police precincts programs and events of the 16th Council District (42, 44, precincts and PSA 7) such as National night out and other special events."
Rivera,Phoenix Theatre Ensemble,East Side Community School (01M450),201562809,5000,DCLA,Funds will support program at East Side Community School.
Rivera,"Pioneers Go East Collective, Inc.",,464133322,5000,DCLA,Funds will support programs and operations.
Powers,"Planned Parenthood of Greater New York, Inc.",Capacity Building for Sexual & Reproductive Health Care Professionals,132621497,8000,DHMH,Funding will support staff and personnel costs for clinical services.
Lee,"Planned Parenthood of Greater New York, Inc.",Council District 23,132621497,5000,DHMH,To help fund Reproductive and Sexual Health programming and services for Council District 23 residents.
Hudson,"Planned Parenthood of Greater New York, Inc.",Culturally Competent Medical Navigation & Mobile Health Resources - Council District 35,132621497,5000,DHMH,Funding to support culturally competent medical navigation and mobile health resources in Council District 35.
Restler,"Planned Parenthood of Greater New York, Inc.",Safeguarding Access to Sexual and Reproductive Health - Council District 33,132621497,5000,DHMH,Funding will support staff and personnel costs for clinical services at Boro Hall Health Center.
Caban,"Planned Parenthood of Greater New York, Inc.",Youth Promoters & Health Services - Council District 22,132621497,5000,DHMH,"Funds will be used to support the YHP program, providing health services to Council District 22."
Rivera,"Playwrights Horizons, Inc.",,132805131,5000,DCLA,Funds will support operations and programs.
Bottcher,"Playwrights Horizons, Inc.",Arts Access Programs,132805131,5000,DCLA,To support Arts Access Programs during the theater season.
Restler,Poetry Society of America,Council District 33,136019220,5000,DYCD,Funds to support public art programming in Council District 33. Page 119 Appendix B: Local Initiatives Council Member Sponsor Legal Name of Organization - Program Name Tax ID Amount Agency Purpose of Funds
Marte,Poets House,,133255098,5000,DCLA,Funds will be used to support programs and services for NYC youth.
Ariola,"Point Breeze Volunteer Fire Department, Inc.",,112452399,10000,FDNY,Funds will be used to support the operation of the firehouse.
Adams,Police Department,106th Precinct Community Safety,136400434,2500,NYPD,Funds will support Community Safety and Victim Services efforts in the 113rd Precinct.
Moya,Police Department,115th Precinct - National Night Out,136400434,5000,NYPD,Funds will be used to support the National Night Out for the 115th Precinct.
Menin,Police Department,19th Precinct Community Council,136400434,5000,NYPD,To provide support for the 19th Precinct Community Council.
Ayala,Police Department,23rd Precinct Community Council,136400434,2000,NYPD,"To support events, activities, and community outreach coordinated by the 23rd community council."
Ayala,Police Department,25th Precinct Community Council,136400434,2000,NYPD,"To support events, activities, and community outreach coordinated by the 25th community council."
Paladino,Police Department,John Papas Transit Bureau K9 Unit,136400434,5000,NYPD,"To support the NYPD Transit Bureau K9 unit in the care, feeding , training, and maintenance of their dogs."
Morano,"Police Organization Providing Peer Assistance (POPPA), Inc.",Council District 51,134128172,5000,DHMH,Funding will be used for support and services in Council District 51.
Ariola,"Police Organization Providing Peer Assistance (POPPA), Inc.",SAFER (Suicide Awareness for Emergency Responders) Program & Events - Council District 32,134128172,15000,DHMH,Funds will support the SAFER (Suicide Awareness for Emergency Responders) program and events within Council District 32.
Salaam,"Police Service Area 6 Community Council, Inc.",,465658652,10000,DYCD,"To support youth and senior engagement through afterschool programs, community gardening, educational assistance, cultural outings, and intergenerational community connections."
Abreu,"Police Service Area 6 Community Council, Inc.",Youth and Senior Programming - Council District 7,465658652,5000,DYCD,Funding to support youth and senior programming.
Hanks,"Port Richmond CERT & Rescue, Inc.",Council District 49,205073806,5000,DYCD,Funding will support various emergency services in Council District 49.
Hanif,"Positive Tails, Inc.",,320410872,5000,DHMH,Free veterinary and wellness clinics
Bottcher,"Poster House, Inc.",Programming for Deaf Community,611763737,5000,DYCD,Funds would go to supporting programming for the deaf community.
Louis,"Power of Millennials, Inc.",Youth Outreach & Events - Council District 45,834688194,5000,DYCD,Funding to support youth outreach and events in Council District 45 and annual boys and girls field trip.
Joseph,"Practical Knowledge, Inc.",Scholarship Strategy Workshops - Council District 40,921552648,5000,DYCD,Funding will be used to enhance and expand Scholarship Strategy Workshops and related programming for college-bound students.
Stevens,"Praise, Peace and Pride, Inc.",Council District 16,133774499,5000,DYCD,Funds will be to support trips and activities to cover admission and fees to residents of Council District 16.
Osse,"Pratt Area Community Council, Inc.",,112451752,10000,HPD,Funding for Tenant Organizing and Affordable Housing services in Council District 36.
Louis,"Pratt Area Community Council, Inc.",Community & Tenant Organizing - Council District 45,112451752,7000,HPD,Funds will be used for Community and Tenant Organizing in Council District 45.
Joseph,"Pratt Area Community Council, Inc.",Council District 40,112451752,10000,DYCD,"Funds will be used to support rapid response online legal clinics, connections to benefits and operational expenses."
Hudson,"Pratt Area Community Council, Inc.",Economic Development & Merchant Organizing - IMPACCT Brooklyn,112451752,9000,SBS,Funding to support merchant organizing and strategizing regular events to increase business in Brooklyn.
Restler,"Pratt Area Community Council, Inc.",Housing Preservation Initiative - Council District 33,112451752,5000,HPD,Funds will help cover programming for assistance accessing affordable housing in District 33. Page 120 Appendix B: Local Initiatives Council Member Sponsor Legal Name of Organization - Program Name Tax ID Amount Agency Purpose of Funds
Hudson,Pratt Institute,Participatory Budgeting Outreach - Council District 35,111630822,5000,DYCD,"Funding for design, planning, and related work to promote Participatory Budgeting in Council District 35."
Farias,"Pregones Touring Puerto Rican Theatre Collection, Inc.",Council District 18,133266893,10000,DCLA,"Funding to support ""ABRAZO / EMBRACE for Mental Health"" in Council District 18."
Speaker,"LGBTQIA+ Pride Center of Staten Island, Inc.",,463358895,40000,DYCD,"To fund youth after-school drop in activities for LGBTQ youth and ally's, which include coming out support groups, therapeutic art programs, self-defense classes, theater workshops, dance and music activities."
Speaker,"Carr Pride Center of Staten Island, Inc.",,463358895,50000,DYCD,Funds will cover administrative and programmatic cost in relation to running the various programs and events at the pride center.
