member,organization,program,ein,amount,agency,purpose
Speaker,"Community Resources Staten Island, Inc.",,135660279,25000,DHMH,"Funding will support the Special Tees program, which imprints or embroiders on a full spectrum of garments, from basic T-shirts and sweatpants to baseball jerseys and jackets, casual and corporate wear, uniforms and sportswear."
Salaam,"Community Voices Heard, Inc.",,133901997,5000,DYCD,"To support efforts to expand voter education, registration, and engagement in low- income, underrepresented communities."
Gutierrez,"Community-Word Project, Inc.",Arts Residency - Public School 084K Jose De Diego (14K084),134114145,5000,DCLA,Funding will support the Arts residency at Public School 84K (14K084).
Caban,"Community-Word Project, Inc.",Collaborative Arts Residency Program,134114145,5000,DCLA,"Funds will be used to defray the operating expenses for programs at Public School 017Q Henry David Thoreau (30Q017), Albert Shanker School for Visual and Performing Art (30Q126), and Public School 234Q (30Q234)."
Banks,"Comprehensive Academics Tutoring Services, Inc.","Workforce Training, Legal Support for Veterans & Community Events",271395375,5000,DYCD,"Funds will support affordable workforce training (OSHA 30, SST, and Security Guard), legal support for veterans and community events."
Abreu,"Comunilife, Inc.",Life is Precious Program - Council District 7,133530299,9000,DYCD,Funding to support suicide prevention for at-risk youth.
Brannan,Coney Island Neighborhood Revitalization Corporation,Economic Mobility Assistance - Council District 47,921820114,5000,DYCD,"Funds to support economic mobility and financial empowerment assistance, events, and training for residents of Council District 47."
Brannan,"Coney Island Sharks, Inc.",Youth Sports & Mentoring Programs - Council District 47,113304418,5000,DYCD,Funds to support youth sports and mentoring programs in Council District 47.
Felder,Cong Chasdei Lev,,454786470,5000,DYCD,Funds to be used to assist with food distribution operations for families in need of food.
Louis,Cong Chasdei Lev,Food Distribution - Council District 45,454786470,5000,DYCD,Funds will be used for food distribution in Council District 45.
Bottcher,Congregation Beit Simchat Torah,Talk to Me About HIV/Aging Together,237406899,5000,DHMH,Funds would go to supporting programming and initiatives.
Brewer,Congregation B'nai Jeshurun Starafroler Hebria,Judith Bernstein Lunch Program,130594858,5000,DYCD,Funds will support food program.
Caban,"Connected Chef Foundation, Inc.",Food Equity Programming,852348659,10500,DYCD,Funds will support the continuation and expansion of Lifeline Groceries’ equitable food distribution across Council District 22.
De La Rosa,Connectemonos,El Conuco: Growing Youth Leadership Through Urban Farming,061603193,5000,DYCD,"Funds will support youth workforce development, sustainable urban farming, and environmental justice."
Paladino,Conrad Poppenhusen Association,Cultural & Historic Programs,111633524,20000,DCLA,The funding engages cultural programs and institutions to provide arts enrichment to the community in Council District 19.
Rivera,"Cooper Square Community Development Committee, Inc.",,132666211,23000,HPD,"Funds will support tenant organizing, advocacy, and eviction prevention programs and operations. Page 56 Appendix B: Local Initiatives Council Member Sponsor Legal Name of Organization - Program Name Tax ID Amount Agency Purpose of Funds"
Marte,"Cooper Square Community Development Committee, Inc.",Tenant Counseling & Organizing Services - Council District 1,132666211,6000,HPD,To provide support tenant counseling and organizing services to residents of Council District 1.
Aviles,"Cora, Inc.",Council District 38,113639921,25000,DCLA,Funds to support Dance Training Programs (including the Cora Youth Companies); Dance Enrichment Programs; and Professional Performances.
Hanks,Coro New York Leadership Center,Council District 49,133571610,10000,DYCD,Funding will support the Neighborhood Leadership Program in Council District 49.
Hanif,Coro New York Leadership Center,Immigrant Civic Leadership Program,133571610,5000,DYCD,Support for the Immigrant Civic Leadership Program.
Krishnan,"Corona Community Ambulance Corps, Inc.",Council District 25,113214382,5000,FDNY,"Funds will be used to support medical equipment, supplies, and training programs to serve within Council District 25."
Vernikov,Council of Jewish Emigre Community Organizations. Inc.,,133955736,10000,DYCD,"Funding to cover costs for food packages delivered to Holocaust Survivors and WWII veterans, delivered by volunteers."
Vernikov,"Council of Jewish Organizations of Flatbush, Inc.",,112864728,10000,DYCD,Funding to sustain the continuous operations of COJOs major areas of support and service that include benefit and entitlement for the needy.
Felder,"Council of Jewish Organizations of Flatbush, Inc.",,112864728,15500,DYCD,"To support benefits and entitlements assistance, legal services, housing counseling and advocacy, immigration assistance, ESOL and HSE (GED) programs, computer classes, financial services, employment services, senior services, and after-school programs."
Joseph,"Council of Jewish Organizations of Flatbush, Inc.",Council District 40,112864728,5000,HPD,Funds will be used to provide assistance with foreclosure prevention.
Vernikov,"Council of Peoples Organization, Inc.",,753046891,15000,DYCD,Funding to connect eligible New Yorkers to benefits through the assistance of case managers who will walk individuals through the application process for various government programs and help them to submit complete applications.
Narcisse,"Council of Peoples Organization, Inc.",Council District 46,753046891,5000,DYCD,Funding to provide social services support and community activities to constituents of Council District 46.
Joseph,"Council of Peoples Organization, Inc.",MCCAP initiative & Access Health NYC initiative - Council District 40,753046891,5000,DYCD,"Funds will support food distribution, NYC MCCAP initiative, Access Health NYC initiative that supports prevention and population health activities."
Banks,Council of School Supervisors and Administrators of the City of NY,Executive/School Leadership Institute (ELI) - Council District 42,112024569,5000,DOE,To provide Executive and School Leadership workshops and programming to Principals at schools in Council District 42.
Schulman,"Council on the Environment, Inc.",Farmstand - Council District 29,132765465,10350,DYCD,Funds to support the operation of the Farmstand Program in Council District 29.
Brannan,"Council on the Environment, Inc.",Green Markets - Council District 47,132765465,10000,DYCD,To support GrowNYC programming and operation of Green Markets in Council District 47.
Menin,"Council on the Environment, Inc.",GrowNYC - Council District 5,132765465,7500,DYCD,To support GrowNYC projects and programs in Council District 5.
Hanif,"Council on the Environment, Inc.",GrowNYC - Greenmarket & Youthmarket farm stands - Council District 39,132765465,10000,DYCD,Funding to support operating expenses of GrowNYC program in Council District 39 including Greenmarket and Youthmarket farm stands.
Stevens,"Council on the Environment, Inc.",GrowNYC Green Space Programs - Council District 16,132765465,20000,DYCD,Funds will be used to support the creation or rejuvenation of a garden or urban farm in Council District 16.
Restler,"Council on the Environment, Inc.",McCarren Park Demonstration Garden - Council District 33,132765465,5000,DYCD,Funds to support the maintenance of McCarren Park Demonstration Garden in Council District 33. Page 57 Appendix B: Local Initiatives Council Member Sponsor Legal Name of Organization - Program Name Tax ID Amount Agency Purpose of Funds
Narcisse,"Covenant Keepers Ministries, Inc.",Stopping The Gun Violence: Saving Our Youth Now,061236554,5000,DHMH,"Funds to provide mental, social and emotional support to youth in an effort to address the root causes of violence."
Stevens,"Crenulated Company, Ltd., The d/b/a New Settlement Apartments",Council District 16,141719016,14000,DYCD,Funds will be used to provide swim scholarships and food to residents of Council District 16.
Joseph,"Crown Heights Jewish Community Council, Inc.",Council District 40,237390996,5000,DSS/HRA,"Funds will support Immigration, Family Crisis Intervention, Employment Assistance, Access to Entitlements, Health Insurance Information, Food Stamps Enrollment, Crime Victims Services."
Hudson,"Crown Heights North Association, Inc.",Preserve Our History in Crown Heights North,200006693,15000,DYCD,"Funding to support community-wide services and goals, including park beautification, historic designation, and seminars."
Won,Culture Lab LIC,Arts & Culture Programming,844694898,12000,DYCD,"Funding will support Arts and Culture Programming including outdoor concerts, art exhibitions, theatrical productions, artist residency programs, and community events."
Joseph,"Cumbe: Center for African and Diaspora Dance, Inc.",Council District 40,475039336,5000,DFTA,"Funding will be used to support compensation for the teaching artists, musicians, program and marketing staff and program expenses to ensure that this rich cultural program remains accessible to NYC residents of limited economic means."
Caban,"Cypreco of America, Inc.",Cypriot Folk Arts Programming - Council District 22,112644226,5000,DOITT,Funds will be used to promote Cypriot folk arts television programming in Council District 22.
Nurse,"Cypress Hills Local Development Corporation, Inc.",East New York Community Center,112683663,40000,DYCD,"Funds will support programming at the Cypress Hills East New York Community Center at Chestnut Commons, including ESL Classes, youth programs, fitness classes, and more."
Nurse,"Cypress Hills Local Development Corporation, Inc.",Fulton Street BID,112683663,25000,DYCD,Funds will provide general support for the Fulton Street BID.
Rivera,"Dance Parade, Inc.",,208576378,5000,DCLA,Funds will support educational programs and parade operations.
Abreu,Dance Project of Washington Heights,Dance Programs - Council District 7,471583227,5000,DCLA,Funding to support dance programming in Council District 7.
Abreu,"Dance Theatre of Harlem, Inc.",Community Programs - Council District 7,132642091,5000,DCLA,Funding to support arts education and community programming in Council District 7.
Salaam,"Dance Theatre of Harlem, Inc.",Council District 9,132642091,5000,DCLA,To help provide free dance programs to Council District 9 community members as a means to create inclusion.
Stevens,"Dances for a Variable Population, Inc.",MOVEMENT SPEAKS - William Hodson Senior Center & Highbridge Senior Center - Council District 16,264572204,10000,DCLA,Funding will support senior dance and community cultural programs: MOVEMENT SPEAKS® at the William Hodson Senior Center in Council District 16.
Hanif,"Dancewave, Inc.",Council District 39,112726558,5000,DCLA,To support dance classes and associated programming in Council District 39.
Ayala,"Dancing Classrooms, Inc.",Core Program Residences & After School Programming - Council District 8,222542960,5000,DCLA,To provide funding to support expenses associated with Dancing Classroom's arts and education programs.
Schulman,"Dancing Classrooms, Inc.",School-Based Residencies - Council District 29,222542960,7000,DCLA,To support Dancing Classrooms' Core Program Residencies and After-School programming in Council District 29.
Zhuang,"Dancing Crane, Inc.",Cultural Dance Programs - Council District 43,061575768,5000,DYCD,Funding to support Cultural Dance Programs in Council District 43.
Nurse,"Day of Independence Committee of Panamanians of New York, Inc., The",Community Initiatives & Annual Panamanian Parade,113287926,8000,DYCD,"Funds will support general program activities, community initiatives, and the Annual Panamanian Parade. Page 58 Appendix B: Local Initiatives Council Member Sponsor Legal Name of Organization - Program Name Tax ID Amount Agency Purpose of Funds"
Brooks-Powers,"Deerfield Area Association, Inc.",Council District 31,112877303,10000,DYCD,Funding will support the annual multi-cultural day activities aimed at bringing residents of the Far Rockaway community together in Council District 31.
Hanks,"Delta Sigma Theta Sorority, Inc. Staten Island Alumnae Chapter",Council District 49,133875643,5000,DYCD,Funds will support community programs and services in Council District 49.
Narcisse,Department of Education,Academy for Conservation and the Environment (18K637) - South Shore Vikings Football Team,136400434,5000,DOE,Funds to provide programming support for South Shore Vikings Football Team.
Moya,Department of Education,After School Program - P.S. 143Q Louis Armstrong (24Q143),136400434,40000,DOE,Funds to operate an after school program at P.S. 143Q Louis Armstrong (24Q143).
Caban,Department of Education,Baccalaureate Program - Public School 151 Mary D. Carter (30Q151),136400434,5000,DOE,Funds will be used to support the Baccalaureate program at Public School 151 Mary D. Carter (30Q151).
Joseph,Department of Education,Brooklyn Institute for Liberal Arts (17K745) - Council District 40,136400434,5000,DOE,Fund to be used for new journalism course and develop a student news publication with support from the Craig Newmark Graduate School of Journalism at CUNY and the Youth Journalism Coalition.
Ayala,Department of Education,Central Park East HS (04M555) - East Harlem Pride,136400434,5000,DOE,"To provide funding to the East Harlem Pride for Sports Equipment, Team Uniforms and Transportation Costs."
Gutierrez,Department of Education,Chess Afterschool - Williamsburg Preparatory School (14K561),136400434,2000,DOE,Funds will support Williamsburg Prep Chess after school at 14K561.
Morano,Department of Education,College of Staten Island High School for International Studies (31R047) - PTA,136400434,4000,DOE,Funds will be used to support the Parent Teacher Association of College of Staten Island High School for International Studies.
Paladino,Department of Education,College Point Collaborative School PS 379Q (25Q379) - Parent Teacher Association,136400434,1000,DOE,Funds will be used to support the Parent Teacher Association of College Point Collaborative School PS 379 (25Q379).
Hanks,Department of Education,Concord High School 470R (31R470),136400434,1000,DOE,Funding will support Concord High School 470R (31R470) Parent Teacher Association.
Gutierrez,Department of Education,Conselyea Preparatory School (14K577),136400434,2000,DOE,Funding will support a field trip to Williamsburg VA.
Hanks,Department of Education,Curtis High School (31R450),136400434,1000,DOE,Funding will support Curtis High School (31R450) Parent Teacher Association.
Hanks,Department of Education,District 31 Region 7 - Federation of Parent Teacher Association,136400434,5000,DOE,"Funding will support Department of Education District 31, Region 7 - Federation of Parent Teacher Association."
Hanks,Department of Education,Eagle Academy For Young Men of Staten Island 28R (31R028),136400434,1000,DOE,Funding will support Eagle Academy For Young Men of Staten Island 28R (31R028) Parent Teacher Association.
Moya,Department of Education,East Elmhurst Community School (30Q329),136400434,5000,DOE,To support an after school program at PS 329 East Elmhurst Community School.
Felder,Department of Education,Edward R. Murrow High School (21K525),136400434,5000,DOE,Funds will be used to support the Holocaust education and awareness programs at Edward R. Murrow High School (21K525).
Menin,Department of Education,Eleanor Roosevelt High School (02M416),136400434,7500,DOE,"Funds will be used for the PTA of Eleanor Roosevelt High School for events, workshops and supplies."
Schulman,Department of Education,Forest Hills High School (28Q440),136400434,5000,DOE,"Funding to support the ""We the People Program"" and the ""Economic Program"" at Forest Hills High School in Queens."
Hanks,Department of Education,Fort Hill Collaborative Elementary School 10R (31R010),136400434,1000,DOE,Funding will support Fort Hill Collaborative Elementary School 10R (31R010) Parent Teacher Association.
Morano,Department of Education,Gaynor McCown High School (31R064) - PTA,136400434,4000,DOE,Funds will be used to support the Parent Teacher Association of Gaynor McCown High School. Page 59 Appendix B: Local Initiatives Council Member Sponsor Legal Name of Organization - Program Name Tax ID Amount Agency Purpose of Funds
De La Rosa,Department of Education,High School For Excellence and Innovation (06M423),136400434,5000,DOE,To support the Journalism Program at High School For Excellence and Innovation (06M423).
Morano,Department of Education,Intermediate School 24R (31R024) - PTA,136400434,4000,DOE,Funds will be used to support the Parent Teacher Association of Intermediate School 24R.
Hanks,Department of Education,Intermediate School 27R (31R027),136400434,1000,DOE,Funding will support Intermediate School 027R Anning S. Prall (31R027) Parent Teacher Association.
Sanchez,Department of Education,Intermediate School 303X Leadership & Community Service (09X303) - Student Government,136400434,10000,DOE,"Funds will be used for student government symposium, leadership activities & community service at Intermediate School 303X (09x303)."
Morano,Department of Education,Intermediate School 34R (31R034) - PTA,136400434,4000,DOE,Funds will be used to support the Parent Teacher Association of Intermediate School 34R.
Hanks,Department of Education,Intermediate School 49R (31R049),136400434,1000,DOE,Funding will support Intermediate School 49R Berta A. Dreyfus (31R049) Parent Teacher Association.
Hanks,Department of Education,Intermediate School 61R (31R061),136400434,1000,DOE,Funding will support Intermediate School 061R William A Morris (31R061) Parent Teacher Association.
Morano,Department of Education,Intermediate School 63R (31R063) - PTA,136400434,4000,DOE,Funds will be used to support the Parent Teacher Association of Intermediate School 63R.
Morano,Department of Education,Intermediate School 72R (31R072) - PTA,136400434,4000,DOE,Funds will be used to support the Parent Teacher Association of Intermediate School 72R.
Morano,Department of Education,Intermediate School 75R (31R075) - PTA,136400434,4000,DOE,Funds will be used to support the Parent Teacher Association of Intermediate School 75R.
Morano,Department of Education,Intermediate School 7R (31R007) - PTA,136400434,4000,DOE,Funds will be used to support the Parent Teacher Association of Intermediate School 7R.
Restler,Department of Education,John Ericsson Middle School 126K (14K126),136400434,25000,DOE,"Funding for parental engagement, community events and to support high needs students at John Ericsson Middle School 126 (14K126)."
Farias,Department of Education,Journalism For All - Gotham Collaborative High School (08X452),136400434,5000,DOE,Funding to support Journalism for All programming at Gotham Collaborative High School (08X452) in Council District 18.
Paladino,Department of Education,Junior High School 193Q Alfred J. Kennedy (25Q193) - Parent Teacher Association,136400434,1000,DOE,Funds will be used to support the Parent Teacher Association of JHS 193 Alfred J. Kennedy (25Q193).
Paladino,Department of Education,Junior High School 194Q William Carr (25Q194) - Parent Teacher Association,136400434,1000,DOE,Funds will be used to support the Parent Teacher Association of JHS 194 William Carr (25Q194).
Paladino,Department of Education,Junior High School 67Q Louis Pasteur (26Q067) - Parent Teacher Association,136400434,1000,DOE,Funds will be used to support the Parent Teacher Association of JHS 67 Louis Pasteur (26Q067).
Ariola,Department of Education,Landscaping Beautification - District 27 Pre-K Center Site at Q439,136400434,5000,DOE,Funds will be used for Landscaping Beautification at the District 27 Pre-K Center Site at Q439.
Ariola,Department of Education,Landscaping Beautification - District 27 Pre-K Center Site at Q464,136400434,5000,DOE,Funds will be used for Landscaping Beautification at the District 27 Pre-K Center Site at Q464.
Menin,Department of Education,Manhattan New School (02M290),136400434,2500,DOE,"Funds will be used for the PTA of Manhattan New School (02M290) for events, workshops and supplies."
Paladino,Department of Education,Middle School 158Q Marie Curie (26Q158) - Parent Teacher Association,136400434,1000,DOE,Funds will be used to support the Parent Teacher Association of MS 158 Marie Curie (26Q158). Page 60 Appendix B: Local Initiatives Council Member Sponsor Legal Name of Organization - Program Name Tax ID Amount Agency Purpose of Funds
Brewer,Department of Education,Middle School M245 (03M245) Computer School,136400434,10000,DOE,Funds will support artist residency programming at M245 (03M245) Computer School.
Riley,Department of Education,Parent Teacher Association - Public School 068X Bronx (11X068),136400434,5000,DOE,Funds to support all P.S 68 related student engagement programming.
Hanif,Department of Education,Park Slope Collegiate (15K464),136400434,5000,DOE,Funding to provide operational support for the Journalism for All program.
Hanks,Department of Education,Port Richmond High School (31R445),136400434,1000,DOE,Funding will support Port Richmond High School (31R445) Parent Tenant Association.
Hanks,Department of Education,Port Richmond High School (31R445) - Boy's Track & Field Team,136400434,5000,DOE,Funding will support the Port Richmond High School - Boy's Track & Field Team in Council District 49.
Hanks,Department of Education,Port Richmond High School (31R445) - Girls Cross Country/Track & Field,136400434,5000,DOE,Funding will support Port Richmond High School - Girls Cross Country/Track & Field.
Hanks,Department of Education,Port Richmond School for Visionary Learning 68R (31R068),136400434,1000,DOE,Funding will support Port Richmond School for Visionary Learning (31R068) Parent Teacher Association.
Sanchez,Department of Education,Public School (09X117) I.S. 117,136400434,5000,DOE,Funds to support a mentoring program for students at I.S. 117 in Council District 14.
Restler,Department of Education,Public School / Intermediate School 157K The Benjamin Franklin Health & Science (14K157),136400434,5000,DOE,"Funding for parental engagement, community events and to support high needs students at Public School / Intermediate School 157K (14K157)."
Restler,Department of Education,Public School 038K The Pacific (15K038),136400434,5000,DOE,Funds to support in school arts & stem residency at Public School 038K The Pacific (15K038).
Restler,Department of Education,Public School 054K The Detective Rafael Ramos School (13K054),136400434,5000,DOE,"Funding for parental engagement, community events and to support high needs students at Public School 54K (13K054)."
Paladino,Department of Education,Public School 079Q Francis Lewis (25Q079) - Parent Teacher Association,136400434,1000,DOE,Funds will be used to support the Parent Teacher Association of PS 79 Francis Lewis (25Q079).
Moya,Department of Education,Public School 092Q Harry T. Stewart Sr. (30Q092) - Dance Program,136400434,20000,DOE,To support the dance class at PS92 (30Q092).
Paladino,Department of Education,Public School 094Q David D. Porter (26Q094) - Music & Coding Classes,136400434,5000,DOE,Funding will support music and coding classes at Public School 94Q (26Q094) in Queens.
Paladino,Department of Education,Public School 107Q Thomas A. Dooley (25Q107) - Parent Teacher Association,136400434,1000,DOE,Funds will be used to support the Parent Teacher Association of PS 107 Thomas A. Dooley (25Q107).
Moya,Department of Education,Public School 110Q Tiffany School (24Q110),136400434,10000,DOE,Funds will support school's curriculum programming for P.S 110Q Tiffany School (24Q110).
Bottcher,Department of Education,Public School 111M Adolph S. Ochs (02M111) - PTA,136400434,5000,DOE,Funds will support the PTA's programming and initiatives.
Carr,Department of Education,Public School 11R (31R011),136400434,5000,DOE,Funds will be used for Academic Intervention Services.
Paladino,Department of Education,Public School 129Q Patricia Larkin (25Q129) - Parent Teacher Association,136400434,1000,DOE,Funds will be used to support the Parent Teacher Association of PS 129 Patricia Larkin (25Q129).
Paladino,Department of Education,Public School 130Q (25Q130) - Parent Teacher Association,136400434,1000,DOE,Funds will be used to support the Parent Teacher Association of PS 130 (25Q130).
Hanks,Department of Education,Public School 13R (31R013),136400434,1000,DOE,Funding will support Public School 013 M. L. Lindemeyer (31R013) Parent Teacher Association. Page 61 Appendix B: Local Initiatives Council Member Sponsor Legal Name of Organization - Program Name Tax ID Amount Agency Purpose of Funds
Schulman,Department of Education,Public School 144Q (28Q144) - Parents Association,136400434,1000,DOE,Funds are to support the Parents Association at Public School 144Q.
Paladino,Department of Education,Public School 159Q Flushing Manor (26Q159) - Parent Teacher Association,136400434,1000,DOE,Funds will be used to support the Parent Teacher Association of PS 159 Flushing Manor (26Q159).
Paladino,Department of Education,Public School 169Q Flushing Manor (25Q169) - Parent Teacher Association,136400434,1000,DOE,Funds will be used to support the Parent Teacher Association of PS 169 Flushing Manor (25Q169).
Hanks,Department of Education,Public School 16R (31R016),136400434,1000,DOE,Funding will support Public School 016R John J. Driscoll (31R016) Parent Teacher Association.
Paladino,Department of Education,Public School 184Q Flushing Manor (25Q184) - Parent Teacher Association,136400434,1000,DOE,Funds will be used to support the Parent Teacher Association of PS 184 Flushing Manor (25Q184).
